scene_id,scene_text,in_summary,aspects
0,"[' ( The camera moves low to the ground . )', ' ( The leaves on the floor are rustling in the night wind . )', ' ( The camera catches up to a pair of legs walking ; a flashlight casting a beam on the ground . )']",0,None
1,"[' ( Man with flashlight looking for something . )', ' ( Fog on the surface of the lake . )', ' ( Flashlight beams on a body partially in the water , partially on the shore . )', "" ( The light beams on the dead body 's face . )"", ' ( GRISSOM kneels in for a closer look . )', "" ( His flashlight catches some bugs on the dead body 's arm . )"", ' ( Without a backward glance , he moves on . )']",0,None
2,"[' ( GRISSOM moves toward an old white pick-up truck . )', "" ( He looks into the carriage and sees a dead body behind the driver 's wheel , a rodent on the cadaver 's left shoulder . )""]",0,None
3,"[' ( GRISSOM walks along and sees something . )', ' ( He kneels down for a closer look . )', ' ( Behind him , a figure of another man makes his way toward GRISSOM . )', ' ( GRISSOM examines the dead body on the ground . )', ' ( The figure behind GRISSOM approaches . )', ' ( The flashlight clutched in his right hand turned off and swinging ominously . )', "" ( GRISSOM does n't move and continues to examine the body on the ground , his back to the approaching figure . )"", ' ( The figure behind reaches GRISSOM and kneels down . )', "" ( He looks at the dead body over GRISSOM 'S shoulder . )"", "" [[Edward_Cormier]] that one 's not ours"", ' [[Grissom]] you sure ?', ' [[Edward_Cormier]] i authorize all cadavers and associated research', "" [[Edward_Cormier]] he 's not ours""]",0,None
4,"["" ( Sign on the fence reads : 'University of Western Nevada / Anthropology Department / Private Property / KEEP OUT / All persons in violation will be prosecuted under section 4204-325.5470 of the Nevada State Penal Code ' )"", ' ( BRASS and CATHERINE walk toward the body . )', ' ( GRISSOM is already there with DAVID PHILLIPS . )', ' [[Brass]] people donate their body to science end up submerged in a pond ?', ' [[Brass]] crammed in a car ?', ' [[Catherine]] body farm ; creepy', ' [[Grissom]] a body farm is not creepy', "" [[Grissom]] it 's a controlled study of situational decomposition"", ' [[Grissom]] all in all , a very healthy place', ' [[Catherine]] tell that to slim hanging from the tree', ' ( CATHERINE looks over at the skeleton hanging from the tree not too far away from the one they were called in to examine . )', ' [[Brass]] whoever placed our victim here knew that the body farm existed', "" [[Brass]] what they did n't know is each body is tracked by a bunch of scientists"", "" [[Catherine]] ca n't just slip a card into the deck"", ' ( CATHERINE starts taking pictures . )', "" [[David_Phillips]] well , he 's not in rigor"", ' [[David_Phillips]] tsd is under six hours', "" [[David_Phillips]] i 'll move him as soon as you 're finished"", ' [[Brass]] any i.d', ' [[David_Phillips]] none', ' ( DAVID stands and steps away from the body . )', "" [[Brass]] okay , i 'm going to move him"", "" ( BRASS rolls the body over so that he 's facing upward . )"", ' ( CATHERINE takes more pictures . )', ' [[Brass]] gunshot wound to the chest', "" ( Camera close up of a beetle walking out of the dead body 's shirt . )"", ' [[Catherine]] well , look', ' [[Catherine]] one of your friends', ' ( GRISSOM leans in an grabs the beetle . )', "" [[Grissom]] it 's a carpet beetle"", "" [[Grissom]] it should n't be here"", ' [[Catherine]] vic seem more like a hardwood floors kind of guy to you ?', "" [[Grissom]] carpet beetles are the last to arrive at a corpse -- when it 's almost a skeleton"", "" [[Grissom]] i mean , this guy 's still fresh"", ' ( GRISSOM looks around and sees the skeleton hanging from the tree . )', "" ( Camera close up on the carpet beetles on the skeleton 's skull . )"", ' [[Grissom]] david !', ' [[Grissom]] get this body out of here now !', ' [[Grissom]] we got cross contamination !']",1,Crime scene
5,"[' ( COMMERCIAL BREAK )', ' ( SARA and CATHERINE are walking from the hallway to the breakroom . )', ' [[Sara]] wow , you got to go to the body farm ?', ' [[Catherine]] yeah', "" [[Sara]] i 've always wanted to go there"", ' [[Sara]] what was it like ?', ' [[Catherine]] quiet', ' [[Warrick]] i hear grissom goes there all the time', ' [[Warrick]] like even on his nights off', "" ( WARRICK does n't lift his head from the newspaper he 's reading . )"", ' ( NICK walks into camera view and heads for the refrigerator . )', ' [[Nick]] why does that not surprise me ?', ' ( He opens the refrigerator and sighs . )', ' [[Nick]] man , something stinks in here again', ' ( NICK grabs his paper package . )', ' [[Sara]] what , bad milk ?', ' [[Sara]] cottage-cheese bad ?', ' [[Nick]] worse', "" [[Nick]] it 's all over my sandwich"", ' [[Nick]] smell that', ' ( He lifts his paper package and SARA reacts to the smell . )', ' ( She kneels and opens the refrigerator , glances in and notices the container on the top shelf . )', ' [[Sara]] yeah', "" [[Sara]] he 's got one of his experiments in there"", "" [[Nick]] you 're kidding me ?"", ' [[Catherine]] bugs or blood ?', ' [[Sara]] not bugs', "" [[Warrick]] oh , that 's so not cool"", "" [[Warrick]] that 's a community fridge"", ' [[Nick]] man , someone has got to talk to grissom about this', ' ( GRISSOM walks in )', ' [[Grissom]] talk to me about what ?', ' [[Nick]] you leaving your experiments in our refrigerator', ' [[Grissom]] well , the lab fridge was full', ' [[Grissom]] i put in last night', ' [[Nick]] well', "" [[Grissom]] i 'm going to test for horizontal motion on bloodstains"", ' [[Grissom]] vis-a-vis surface textures', ' ( NICK looks annoyed . )', ' ( CATHERINE takes a sip of her coffee and discretely tries to ignore the smell . )', ' ( GRISSOM is clueless as he takes out the container of blood from the fridge and opens it . )', ' [[Grissom]] hey , any of you guys got any linoleum at home ?', ' ( CATHERINE catches a whiff of the open container and this time , she discretely pinches her nose trying to avoid the smell . )', ' ( SARA is quiet . )', ' [[Nick]] that blood is rank , man', ' [[Grissom]] i know', "" [[Grissom]] that 's why the red cross gives it to us 'cause it 's past its expiration date"", ' ( GRISSOM merrily closes the cap on the container , opens the fridge and puts it back on the top shelf . )', ' ( He shuts the door and stands up . )', ' [[Grissom]] anything new on the body farm victim ?', ' ( CATHERINE takes another sip from her coffee mug . )', ' [[Catherine]] i gave the prints to identification', "" [[Catherine]] they 're running through the bases now"", ' [[Grissom]] okay', ' ( GRISSOM turns to leave the room . )', "" ( Someone 's pager goes off . )"", "" ( It 's GRISSOM 'S . )"", "" [[Grissom]] i 'll be in autopsy"", ' [[Grissom]] let me know', ' ( GRISSOM leaves . )', ' [[Warrick]] way to go , nick', ' [[Warrick]] you really told him', "" [[Nick]] i told him , he just ... does n't hear it"", ' [[Warrick]] yeah']",0,None
6,"[' ( Top view close up of dead body from the Body Farm . )', ' ( ROBBINS has his finger in the bullet hole . )', ' [[Robbins]] well ... the entry wound tells me the body sustained a projectile', ' [[Grissom]] a bullet', "" [[Robbins]] uh , but there 's no bullet fragments in the tissue and no exit wound"", ' [[Grissom]] so , how do you explain that ?', ' [[Robbins]] bullet wounds usually leave bullet evidence', ' ( Flash to white . )', ' ( Quick CGI POV of hand holding gun and squeezing trigger . )', ' ( Sound of gun firing . )', ' ( Camera close up of hammer cocking back and extreme close up of hammer hitting the 38 SPL bullet . )', ' ( Quick FX to bullet firing through the barrel of the gun and penetrating through the skin with bits of flesh splattering out . )', ' ( Bullet continues its path through the body . )', ' ( Cut to inside view of the body where bits and pieces of bone and bullet break up inside the body where some pieces embed themselves to the nearest organ . )', ' ( Flash to white . )', ' ( End of CGI POV . )', ' ( Resume to present . )', "" [[Robbins]] there 's no evidence of a bullet in this wound tract"", "" [[Grissom]] so , let 's excise it"", ' [[Grissom]] do a more localized search', ' [[Robbins]] that was my next suggestion', "" [[Grissom]] what 's your best tool for excising the tissue of our mr doe ?"", ' ( CATHERINE walks in )', "" [[Catherine]] oh , it 's not a john doe anymore"", ' [[Catherine]] database says that our victim is mike kimble age 38', ' [[Catherine]] he has a townhouse in summerlin brass is going to meet us there along with the rest of the unit', "" [[Catherine]] my bet says that it 's the primary crime scene"", ' [[Grissom]] good', ' ( GRISSOM takes off his glasses . )', "" ( CATHERINE turns to leave and stops as she notices that GRISSOM 'S not moving from his spot next to the autopsy table . )"", "" [[Catherine]] are n't you coming ?"", "" [[Grissom]] we 're excising a wound tract"", ' [[Catherine]] sounds fascinating', ' [[Grissom]] it is', ' ( ROBBINS turns on the hand saw . )', ' ( The blade whirs . )', ' ( Off a camera close up of the hand saw , we hear a fire engine siren blaring . )']",1,Victim
7,"[' ( Sirens blare . )', ' ( CATHERINE runs past firetruck # 27 and finds WARRICK standing on the sidewalk with his CSI kit in his left hand staring at the house on fire in front of him . )', "" [[Catherine]] is that mike kimble 's house ?"", "" [[Warrick]] that 's it"", ' ( A large explosion emits from the second story window . )', ' [[Catherine]] seems like somebody beat us here', ' [[Warrick]] you think ?', ' [[Warrick]] neighbor called it in she smelled the smoke', ' [[Warrick]] thought he was barbecuing in his living room', "" [[Catherine]] where 's his neighbor now ?"", ' [[Warrick]] over there talking to brass', "" [[Female_Neighbor]] um , no , i did n't hear any noise coming from mike 's place last night"", ' [[Female_Neighbor]] but , um', ' [[Female_Neighbor]] i was wearing my headphones , doing my workout', ' [[Brass]] did mr kimble have many visitors to his house ?', ' [[Female_Neighbor]] other than his clients , just , um ... just his fiancée , jane', ' [[Female_Neighbor]] uh , but they usually stayed at her place', "" [[Brass]] do you have the full name and address of the victim 's fiancée , jane ?"", ' [[Female_Neighbor]] yes , actually i do', "" [[Female_Neighbor]] it 's in my kitchen"", ' [[Female_Neighbor]] uhm ... as soon as they let me back in i can get for you']",0,None
8,"[' ( ROBBINS pulls out something gooey from the body . )', ' [[Robbins]] something', ' [[Robbins]] a metal fragment', "" [[Robbins]] it 's not like any bullet i 've ever seen"", ' ( Camera close up of the piece of metal ROBBINS holds . )', ' [[Robbins]] titanium ... maybe a pin', ' [[Grissom]] from the ribs ?', "" [[Robbins]] oh , here 's the manufacturer 's number"", "" [[Robbins]] i should 've bought stock when i first started finding all these medical implants"", "" ( GRISSOM does n't say anything . )"", ' ( He pulls out a maggot . )', ' [[Grissom]] bovine', ' [[Robbins]] excuse me ?', ' [[Grissom]] genus hypaderma', ' [[Grissom]] these are normally found in the intestinal tract of cows', "" [[Grissom]] these maggots are n't found in humans"", ' [[Robbins]] foreign tissue', ' [[Robbins]] cow', ' [[Robbins]] makes absolutely no sense', ' [[Grissom]] the body farm also studies animals , not just humans', ' [[Robbins]] this more of your cross contamination ?', ' [[Grissom]] only one way to find out', ' ( GRISSOM smiles at the thought of yet another experiment . )']",0,None
9,"[' ( Firemen on a ladder and in the second floor of the burnt home . )', ' ( Water pours from the room onto the ground below . )']",0,None
10,"[' ( NICK walks through the hallway , his flashlight lighting his way . )', ' ( He turns the corner and sees WARRICK . )', ' ( He puts his CSI kit down . )', ' [[Warrick]] what up , doc ?', ' [[Warrick]] oh , there you are', "" [[Nick]] sorry i 'm late"", ' [[Nick]] d.a', ' [[Nick]] wanted an update on my robbery case', "" [[Warrick]] oh , it 's all good"", "" [[Warrick]] i 'm just starting my walk-through"", ' [[Nick]] the desk is crispy', "" [[Warrick]] there 's a burn pattern for you"", ' [[Warrick]] fire burns upward', ' [[Warrick]] this is moving downward', ' [[Nick]] defies the laws of physics', "" [[Nick]] fire 's drawn to fire"", ' [[Nick]] well , you know what we got ta do', ' [[Warrick]] check out the upstairs ?']",0,None
11,"[' [[Nick]] the guy who started the fire wanted to make sure the bedroom got it worse', "" [[Warrick]] how do you know it 's a guy ?"", ' [[Warrick]] why are you jumping the gun ?', ' [[Nick]] well , according to sara , 94 % of all arsonists are male', ' [[Warrick]] yeah , that sounds like sara', ' [[Nick]] the fire burned longest here', "" [[Warrick]] it 's the point of origin"", ' [[Nick]] yeah , right here', ' ( WARRICK leans in and sniffs . )', "" [[Warrick]] i do n't smell any accelerant"", ' [[Nick]] could have burned off', ' [[Nick]] fabric would have fueled it', "" [[Warrick]] i do n't know"", "" [[Warrick]] it does n't make any sense"", ' [[Warrick]] a fire burning downward ?', ' ( Flash to white . )', ' ( CGI POV of fire burning near vent . )', ' ( Camera moves toward the vent and through the vent . )', ' ( Camera cut to inside the vent where the fire quickly moves up the vent and to the second floor where it starts up again by burning the desk . )', ' ( Flash to white . )', ' ( More fire flames getting larger and larger . )', ' [[Nick]] yeah , unless it was chasing after an accelerant', ' [[Warrick]] furniture polish', ' ( Flash to white . )', ' ( End of flashback . )', ' ( Resume on NICK . )', ' [[Nick]] warrick ... is that blood ?', "" ( NICK casts the light of his flashlight at WARRICK 'S feet . )"", ' ( WARRICK looks down , steps off of the carpet and lifts it up to reveal a large blood stain )', ' [[Warrick]] oh , man', ' [[Warrick]] something bad happened here', ' [[Nick]] this fire is just a cover up']",1,Crime scene
12,"[' ( CATHERINE and BRASS ring the doorbell . )', ' ( JODY BRADLEY opens the door . )', "" ( She 's on the phone . )"", ' [[Jody_(giggling)]] are you serious ?', ' [[Jody_(giggling)]] hold on a second', ' [[Jody_(giggling)]] hi', "" [[Brass]] i 'm detective jim brass"", ' [[Brass]] is jane bradley in ?', "" [[Jody_Bradley]] she 's in the kitchen"", ' [[Jody_Bradley]] really ?', ' [[Jody_Bradley]] no way', ' ( She holds the door open . )', ' ( CATHERINE and BRASS enter the house . )']",0,None
13,"[' ( Camera close up on several pictures of MIKE KIMBLE with the BRADLEY family . )', "" [[Jane_Bradley]] this ca n't be happening"", ' [[Jane_Bradley]] mike is dead ?', "" [[Jane_Bradley]] i do n't know how i 'm going to tell my kids"", ' [[Jane_Bradley]] they love mike', ' [[Catherine]] you and mike were engaged ?', ' [[Jane_Bradley]] the wedding was supposed to be in a week at the tangiers', ' ( JAKE BRADLEY enters the kitchen . )', ' ( He has earphones on and walks straight for the refrigerator . )', ' ( He opens the door . )', ' [[Jane_Bradley]] no sweets after ten', "" [[Jane_Bradley]] what 's the rule ?"", "" [[Jake_Bradley]] oh , come on , mom , i 'm starving"", "" ( JANE BRADLEY takes the sweets out of her son 's hand and replaces it with an apple . )"", ' [[Jane_Bradley]] have an apple', ' ( He groans and walks out of the kitchen . )', "" [[Jane_Bradley]] he 's growing like a weed"", "" [[Brass]] what was your fiancé 's business ?"", ' [[Jane_Bradley]] he was a photographer', ' [[Jane_Bradley]] he did weddings , events', "" [[Jane_Bradley]] we argued over who 'd do our wedding because he did n't trust anyone else 's work"", ' ( In the background a door opens and closes . )', ' ( RUSS BRADLEY enters . )', ' [[Russ_Bradley]] hi', ' [[Jane_Bradley]] how many times have i said you have to knock ?', "" [[Jane_Bradley]] you ca n't just barge in this house"", "" [[Russ_Bradley]] maybe as many times as i 've asked you to have the kids ready and out front on my nights ?"", ' [[Brass]] you must be the ex-husband', "" [[Russ_Bradley]] what 's going on ?"", ' [[Russ_Bradley]] are the kids all right ?', ' [[Russ_Bradley]] is jake in some kind of trouble ?', ' [[Jane_Bradley]] no', ' [[Brass]] mike kimble was killed tonight', ' [[Russ_Bradley]] are you serious ?', ' [[Catherine]] would you mind showing us your hands ?', ' [[Russ_Bradley]] my hands ?', ' [[Russ_Bradley]] why ?', "" [[Catherine]] to see if there 's any gun powder or evidence of a burn on them"", ' [[Russ_Bradley]] sure', "" [[Russ_Bradley]] look , uh , i do n't want to be rude , but"", ' [[Russ_Bradley]] i stop paying alimony the day mike and jane get married', "" [[Russ_Bradley]] i mean , i 'm the last person who would have killed him"", ' [[Brass]] if we wanted to get in touch with you , how would we reach you ?', ' [[Russ_Bradley]] you can reach me at any of my four grocery stores', ' [[Russ_Bradley]] any time', ' ( RUSS BRADLEY pulls out a business card from his wallet and gives it to BRASS . )', "" [[Brass]] we 'll be in touch"", "" [[Russ_Bradley]] i 'm going to get the kids , if that 's all right"", "" [[Jane_Bradley]] they 're in the den""]",1,Perpetrator
14,"[' ( Water drips from the ceiling . )', ' ( NICK is crouched low with a machine in his hands . )', ' ( The machine beeps steadily . )', ' ( GRISSOM enters the room from the hallway just as the machine starts to beep rapidly . )', ' [[Grissom]] accelerant', ' ( NICK looks up . )', ' [[Nick]] hey', ' [[Nick]] yeah , warrick said the fire was orange so low-temperature fuel', ' [[Nick]] something accessible ... gasoline , kerosene', ' [[Nick]] i thought you were at the post', ' [[Grissom]] i was', ' [[Nick]] so , anyway , this is where the fire started', "" [[Nick]] victim 's bedroom"", ' ( GRISSOM starts looking around . )', ' ( NICK stands and starts looking around as well . )', ' ( GRISSOM moves off into another room . )', ' ( NICK glances at a burnt photograph in a frame . )', ' ( GRISSOM finds a room that was not burned by the fire . )', "" ( He examines the items that was n't burned . )"", ' ( NICK catches up with GRISSOM and follows . )', ' ( GRISSOM pans the room with photographer equipment in it . )', ' ( Something catches his eye . )', "" ( A photograph in a frame of MIKE KIMBLE and the BRADLEYS holding a sign : 'Mike : Welcome to the Family ' . )"", ' ( The same sign in propped up on the file behind the picture frame . )', ' ( GRISSOM moves in for a closer examination of the picture . )', ' ( He frowns . )', ' ( NICK enters the room . )', ' [[Nick]] grissom ... gris', "" [[Grissom]] sometimes , it 's about where the fire is n't"", ' ( GRISSOM removes the photo out of its frame . )', ' ( Behind the photo is a picture of JODY BRADLEY . )', ' ( Two photographs of her in suggestive poses , and a third with her naked back to the camera and looking over her shoulder . )', "" ( GRISSOM holds the photo comparatively to the family photograph where we can see that it 's definitely JODY BRADLEY , the daughter , and not JANE BRADLEY , the fiancée . )"", ' ( Both GRISSOM and NICK are grim at the find and its implications . )', ' [[Nick]] sometimes , i hate this job']",0,None
15,"[' ( JODY BRADLEY is sitting on the waiting bench outside the interrogation room , her knees hugged close to her chest . )', ' ( An officer stands nearby . )', ' ( JANE BRADLEY watches her through the glass wall from inside the interrogation room . )']",0,None
16,"[' [[Catherine]] we have evidence that mike may have had an inappropriate relationship with your daughter', ' [[Jane_Bradley]] what kind of evidence ?', ' ( JANE BRADLEY turns around and walks back to face BRASS and CATHERINE . )', ' [[Brass]] photographic and definitive', "" [[Jane_Bradley]] that the man i was going to marry somehow sexually ... no , i do n't believe that"", ' [[Catherine]] things like this happen sometimes right under our noses', "" [[Catherine]] we 're going to have to talk with your daughter""]",0,None
17,"["" [[Catherine]] jody , we found pictures in mike 's house of you posing"", ' [[Jane_Bradley]] tell her mike would never do anything to hurt you', ' [[Catherine]] in some of the pictures', ' [[Jane_Bradley]] he truly was like a father to both kids', ' [[Jody_Bradley]] i wish you would just listen once', "" [[Catherine]] in some of the pictures you 're wearing a bathing suit"", ' [[Catherine]] do you remember mike taking them ?', ' ( JODY BRADLEY looks at CATHERINE . )', ' ( Quick flashback of camera flashes of JODY wearing a shirt and turning around ; JODY taking the shirt off her shoulders ; and three camera flashes of JODY close up . )', ' ( Flash to white . )', ' ( End of flashback . )', ' ( Resume to present . )', ' ( JODY BRADLEY shakes her head , no . )', ' [[Catherine]] jody ... anything that he did to you was not your fault', ' [[Catherine]] you can tell me if mike took those pictures', ' [[Jane_Bradley]] jody ?', ' [[Jane_Bradley]] honey ?', ' [[Jody_Bradley]] i loved mike and he loved me', ' ( CATHERINE leaves the room . )', ' ( BRASS is waiting just outside where he was watching through the glass . )', ' ( CATHERINE closes the door . )', ' [[Catherine]] the daughter clammed up', ' [[Catherine]] seems to be in the protect-the-abuser trap', "" [[Catherine]] i 'm going to take her over to the hospital for a sart exam"", ' [[Brass]] what are the chances mom knew what her boyfriend was up to ?', "" [[Catherine]] i 've seen it happen"", ' [[Catherine]] as a mother , i hope not', ' [[Brass]] yeah , right', "" [[Brass]] i 'm going to look into it""]",0,None
18,"[' ( Camera close up of the computer screen with the JODY BRADLEY photo . )', ' ( WARRICK is working on it . )', ' ( NICK enters the room carrying a bagged camera . )', "" [[Nick]] well , our photo guys tell me those pictures were taken with mike kimble 's type of camera"", ' ( NICK puts the bagged camera down on the table . )', ' [[Warrick]] yeah ?', ' [[Nick]] yeah', ' [[Nick]] what are you doing here ?', ' [[Warrick]] a thousand points of light and i only need one to clear up this picture', ' [[Warrick]] the blur equals the length of the light', ' ( NICK moves closer to the screen to get a better look . )', "" ( The computer screen shows the numbers for 'CALCULATING REFRACTION - POINTS ' change rapidly ... )"", ' ( Close up of a fuzzy JODY BRADLEY with the following on screen: )', ' ( which changes to ... )', ' ( Extreme close up of an unfocused JODY BRADLEY being focused . )', ' [[Warrick]] if i can compress this light back into a point then the rest of the picture gets clear', "" [[Warrick]] that 's how they got hinkley 's image when he was shooting the prez"", ' [[Nick]] what is that ?', ' [[Nick]] there at the bottom right corner ?', ' [[Nick]] is that a finger ?', ' [[Warrick]] yeah , i think so', "" [[Nick]] well , that 's unusual , is n't it ?"", ' [[Nick]] a professional photographer gets a finger in the shot ?', ' [[Warrick]] maybe his good hand was otherwise engaged', "" [[Warrick]] i 'm going to work on that for a while and see if i can get some ridge detail"", ' [[Warrick]] maybe even a fat print', "" [[Nick]] i 'll"", "" [[Nick]] i 'll see you later"", ' ( NICK leaves the room . )']",0,None
19,"[' ( Camera focused on a chunk of raw meat covered with flies under a net . )', ' ( GRISSOM is peering at the experiment though a magnifying glass . )', ' ( SARA walks in )', ' [[Sara]] so , this is your experiment , huh ?', ' [[Sara]] so , because you found beef in the wound tracts of the victim , you think the meat might be from one of the body farm cows ?', ' [[Grissom]] did the fly find the beef in the wound and lay its eggs or did it bring the beef with him ?', ' [[Sara]] i did an experiment similar to this in san francisco except the cross-contamination was blood', "" [[Sara]] was n't a murder case , but it was instructional"", ' ( GRISSOM straightens and puts the magnifying glass down . )', "" [[Grissom]] none of these beef particles are as big as the tissue found in mike kimble 's wound tract"", ' [[Grissom]] and i found out the ex-husband is the proud owner of a registered handgun', ' [[Sara]] hmm , what does that mean ?', ' [[Grissom]] it means i need to see that gun', ' ( GRISSOM heads toward the door to leave . )', ' ( SARA stops him . )', "" [[Sara]] uh , grissom ... are n't you going to tell me anything ?"", ' [[Grissom]] about ?', ' [[Sara]] the case , the meat , what you found ... ?', "" [[Grissom]] i 'm working it"", ' [[Sara]] i thought i was working it with you', ' [[Grissom]] yes', "" [[Grissom]] you 're right , you are"", ' [[Grissom]] so , take some photos of the experiment for the d.a', ' [[Grissom]] and then ... uh ... get rid of that stuff', ' ( GRISSOM turns to leave . )', ' ( SARA stops him again )', ' [[Sara]] that meat ... the raw meat ... me ?', ' [[Grissom]] yeah', ' [[Sara]] how many meals have we shared together ?', "" [[Grissom]] i do n't know"", ' [[Sara]] take a guess -- over a year working together', ' [[Grissom]] thirty', "" [[Sara]] i 'm a vegetarian"", "" [[Sara]] everyone here knows i 'm a vegetarian"", "" [[Sara]] i have n't eaten meat since we stayed up that night with that dead pig"", ' [[Sara]] it pains me to see ground beef ; forget about cleaning it up', ' [[Grissom]] okay', ' [[Grissom]] have nick do it', ' ( GRISSOM leaves . )', ' ( SARA seems ... extremely disappointed with the exchange . )']",0,None
