scene_id,scene_text,in_summary,aspects
0,"[' ( A PARK RANGER driving along the road route and notices a car parked on the side of the road . )', ' ( He stops the car to check it out . )', ' ( Garbled radio transmissions can be heard in the background . )', ' ( He gets out of the car and puts on his park ranger hat . )', ' ( The officer walks to the edge of the road , slips and rolls down the hill . )', ' ( When he comes to a stop , he lands next to a dead body . )', "" ( In the shadow of the bright light , there 's a man holding a shovel , digging a hole - caught in the act trying to bury the body . )"", ' ( Frozen for a moment , the man springs into action . )', ' ( He throws the shovel aside and tries to run , the officer stops him . )', ' [[Benjamin_Jennings]] no !', ' [[Benjamin_Jennings]] no !']",0,None
1,"[' ( GRISSOM and NICK make their way down the ledge to the crime scene . )', ' ( There are five police vehicles there and a swarm of officers near the crime scene looking for further evidence on the grounds . )', ' ( Kneeling next to the body is a Technician with a clipboard . )', "" ( SGT O'RILEY meets up with GRISSOM and NICK . )"", ' [[Grissom]] call said one dead body', "" [[Sgt._O'Riley]] caught him red-handed"", "" [[Sgt._O'Riley]] ben jennings"", ' ( Off to the side , BENJAMIN JENNINGS stands hands cuffed behind his back with three officers standing watch over him . )', ' ( NICK and GRISSOM approach the men . )', ' [[Nick]] nick stokes , gil grissom , las vegas crime lab', "" [[Nick]] you want to tell us what 's going on ?"", ' [[Nick]] what happened here ?', "" ( BENJAMIN JENNINGS does n't respond . )"", ' [[Grissom]] you have anything to say ?', "" ( He still does n't respond . )"", "" [[Grissom]] you do n't have to talk to us"", ' ( GRISSOM shines the light of his flashlight on the dead body . )', "" [[Grissom]] he 'll talk to us""]",1,Perpetrator
2,"[' ( Camera opens on the body . )', ' ( GRISSOM and NICK are crouched low examining the body . )', ' ( Garbled radio transmissions can be heard in the background . )', ' [[Nick]] see that lividity ?', ' [[Nick]] blood settled at the time of death', "" [[Grissom]] body 's been moved from the murder scene"", ' [[Grissom]] impound his car', ' ( SARA shows up . )', ' [[Sara]] sorry , guys', ' [[Sara]] i lost you at the fork', ' [[Nick]] my bad , sara', ' ( GRISSOM looks up at BENJAMIN JENNINGS . )', "" [[Grissom]] let 's process this guy shall we ?"", ' [[Grissom]] officer , would you uncuff him , please ?', ' ( The officer uncuffs BENJAMIN JENNINGS . )', ' ( GRISSOM takes out a black light and begins examining him from the back . )', ' ( NICK puts his CSI kit down . )', ' [[Nick]] okay , make like a scarecrow for me , partner', "" ( BENJAMIN JENNINGS does n't move . )"", ' ( NICK spreads his arms out to show him what he means . )', ' ( BENJAMIN JENNINGS copies him . )', ' [[Nick]] arms out , away from your body', "" [[Nick]] that 's it"", ' [[Nick]] stay just like that', ' ( SARA crouches low on the ground to collect his shoe prints . )', ' [[Sara]] give me your right foot', ' [[Sara]] other right', ' [[Sara]] put it down', ' [[Sara]] lift it up', ' ( NICK checks out the front and begins collecting . )', ' ( GRISSOM finds something on his back . )', ' [[Grissom]] hold still', ' ( He finds a single strand of hair and holds it up . )', ' [[Grissom]] possible secondary transfer', ' [[Nick]] got some red fibers', ' [[Sara]] other foot', ' [[Sara]] lift it up', ' [[Sara]] put it down', "" ( GRISSOM examines BENJAMIN JENNINGS ' arms )"", ' [[Grissom]] no defensive wounds', ' [[Grissom]] no hematomas', "" [[Nick]] victim did n't fight back"", "" [[Nick]] probably did n't see it coming"", ' [[Grissom]] matthew ... tag that body for special processing , vip room', "" [[Grissom]] do n't wash it till i get there , and do n't touch his fingernails""]",0,None
3,"["" ( WARRICK 'S SUV stops outside the hotel . )"", ' ( CATHERINE is holding a piece of paper and reading as she and WARRICK enter the hotel . )', "" [[Catherine]] 'd.b"", "" [[Catherine]] ... mediterranean casino ... women 's spa '""]",0,None
4,"[' ( BRASS is already there when WARRICK and CATHERINE enter the locker room area . )', ' ( BRASS meets them and they all start walking to the body . )', ' [[Brass]] body is shelley danvers', ' [[Brass]] dob : 10/10/81', ' [[Brass]] employee walked in to get towels']",1,Victim
5,"[' [[Brass]] ... found her here', "" [[Catherine]] a young woman , healthy , just reading a magazine and all of a sudden she dfo 's ?"", ' [[Brass]] done fell out', "" [[Brass]] that 's what the night manager says"", ' ( WARRICK turns his head and sees the Night Manager talking with an officer . )', ' [[Warrick]] miss ?', ' ( WARRICK approaches the Night Manager . )', ' [[Kim_Marita]] excuse me', "" [[Warrick]] we 're from the crime lab"", ' [[Warrick]] you found the deceased ?', ' [[Kim_Marita]] yes , i was , um ... just getting some towels and i walked in and she was there', ' ( CATHERINE looks at the body and notices the knot on the robe on the deceased . )', ' [[Catherine]] hey , brass ... you touch this body ?', ' [[Brass]] yeah , i was born yesterday', ' [[Catherine]] well , it looks as if the sash may have been tied by somebody else', ' [[Catherine]] miss ... you know anything about redressing the body ?', ' [[Kim_Marita]] well , she was naked', ' [[Kim_Marita]] i-i-i thought she should be covered', ' [[Catherine]] did you move the body here , too ?', ' [[Kim_Marita]] guests were looking in', ' [[Kim_Marita]] i put a robe on her', "" [[Kim_Marita]] it 's not like it 's a crime or anything"", ' [[Catherine]] actually , it is', "" [[Warrick]] makes us doubt the circumstances surrounding the victim 's death"", "" ( Camera holds on KIM MARITA 'S concerned look . )""]",0,None
6,"["" ( SARA scrapes off something from the dead body 's forehead . )"", ' [[Sara]] flour , maybe ?', ' [[Grissom]] but what kind ?', ' [[Grissom]] all-purpose ?', ' [[Grissom]] self-rising ?', ' [[Grissom]] pastry ?', ' [[Sara]] trace will probably have a better idea', "" [[Sara]] i 'll get dna to see if there 's bits of ben under the fingernails"", ' [[Grissom]] what about the neck ?', ' [[Grissom]] any fibers in the wound ?', ' [[Sara]] you told me to wait for you', "" [[Grissom]] well , that has n't stopped you yet"", ' [[Sara]] i did observe some fibers in the wound', "" [[Sara]] i did n't collect them , though"", ' [[Grissom]] be my guest', "" ( SARA picks up the fibers from the dead body 's neck . )"", ' ( Camera close up on the fibers . )', ' [[Sara]] yellow', ' [[Sara]] not cotton ; satin , maybe', ' ( GRISSOM straightens and looks down at the body . )', ' ( He notices something . )', ' [[Grissom]] dress shirt ... but no tie', ' [[Sara]] strangled with his own tie ?', ' [[Grissom]] find me on the flour', ' ( GRISSOM leaves . )']",0,None
7,"["" ( A red-bordered bar scrolls down the spa 's appointment list of names on the computer for that night . )"", "" [[Warrick]] 'shelley danvers ' -- appointment 8:00"", ' [[Catherine]] ms marita , did the deceased use the jacuzzi facilities this evening ?', ' [[Kim_Marita]] not that i remember , no', ' [[Kim_Marita]] what ?', "" [[Kim_Marita]] you do n't believe me ?"", ' [[Warrick]] well , you lied to us before', "" [[Catherine]] it 's , uh , not uncommon to drown in a jacuzzi"", ' [[Catherine]] hair gets caught in the whirl a person gets dragged under', "" [[Catherine]] the hotel would n't be considered unsafe"", "" [[Kim_Marita]] well , that did n't happen here"", ' [[Kim_Marita]] she did not drown on these premises', "" [[Warrick]] well , if she did , the coroner would find water in her lungs but it 'd be worse hearing it from him than from you""]",0,None
8,"[' [[Robbins]] oliver dunne', ' [[Robbins]] corporate lawyer', ' [[Robbins]] father of two', ' [[Grissom]] you get all that from his ... uh ... dentals ?', ' [[Robbins]] his wife -- widow', ' [[Robbins]] she came down to i.d', ' [[Robbins]] his property', ' [[Grissom]] .380s ?', ' [[Robbins]] last one i recovered entered through his abdominals', ' ( CGI POV flash to white as the bullet penetrates an x-ray black and white replication of the body . )', ' ( Resume to present . )', ' ( Camera on GRISSOM . )', ' [[Robbins]] ... pierced the liver , lodged in the oblique', "" [[Grissom]] that 's not what killed him , is it ?"", ' [[Grissom]] we pulled a yellow fiber out of the neck wound', "" [[Grissom]] i think it 's from his tie"", ' [[Robbins]] you might be right', ' [[Robbins]] he died of asphyxiation', ' [[Robbins]] tie probably closed the windpipe', ' ( White flash to CGI POV as an x-ray bluish-white replication of a hand grasping a neck . )', ' ( Sounds of a person choking . )', ' ( Camera moves up the body through the mouth , down the throat , through the windpipe , into the lungs to a magnification of red and black colored air sacs . )', ' ( End of CGI POV . )', ' ( Resume on ROBBINS . )', ' [[Robbins]] without oxygen , the alveoli capillaries wither and dry up', ' [[Robbins]] whole pulmonary system shut down', ' [[Robbins]] what you may have here is the smallest sliver of the murder weapon', ' [[Grissom]] why would a guy shoot a man three times and then strangle him with his own tie ?', ' ( SARA enters holding the file folder with the results of the flour test . )', ' [[Sara]] i can not tell you why , but i might be able to tell you where', ' [[Sara]] a pizza shop', "" [[Sara]] the flour on oliver dunne has a low gluten content -- seven percent protein -- it 's typical of flour used to make cakes , pizzas , that kind of thing"", ' [[Grissom]] so , why did you rule out bakeries ?', ' [[Sara]] well , the subtype of flour is another subtype -- double zero', "" [[Sara]] it 's a very fine flour used only in pizza-baking ovens"", ' [[Sara]] oh , and trace picked up some oregano in the sample', ' [[Sara]] when are you set to interview ben ?', ' ( Camera holds on GRISSOM . )']",1,"Victim,Death cause,Evidence"
9,"["" [[Brass]] you 're the registered owner of a lorcin .380"", ' [[Brass]] takes the same caliber bullet as the slugs we took out of the victim', "" [[Brass]] so , i 'm going to ask you one more time"", "" [[Brass]] where 's your gun ?"", ' [[Benjamin_Jennings]] i lost it', ' [[Brass]] do you think we believe that ?', ' [[Brass]] do you think', ' [[Grissom]] are you employed , ben ?', "" [[Benjamin_Jennings]] yeah ... yeah , um ... it 's a place called dante 's pizzeria"", "" [[Benjamin_Jennings]] it 's behind the strato '"", ' [[Grissom]] you make pizzas ?', ' [[Benjamin_Jennings]] well , i deliver the pizzas', "" [[Benjamin_Jennings]] it 's too hot back there with all the ovens and stuff"", "" [[Grissom]] do you , uh ... ever come into contact with the baking flour at dante 's ?"", ' [[Benjamine_Jennings]] mostly pizza boxes', ' [[Benjamine_Jennings]] why ?', "" [[Grissom]] well , 'cause we found flour on the victim and it 's the kind that 's used to make pizza"", ' [[Grissom]] can you explain that ?', ' [[Benjamin_Jennings]] no', "" [[Grissom]] ben , why do n't you earn yourself some points by telling me what the science is going to tell me anyway ?"", "" [[Benjamin_Jennings]] well , i do n't have to talk"", "" [[Grissom]] no ... but we 're going to figure it out"", ' [[Benjamin_Jennings]] look , if you know so much about these murders what do you need me for ?', ' [[Grissom]] murders ?', ' [[Grissom]] there are more bodies ?', ' ( Camera holds on BENJAMIN JENNINGS . )']",0,None
10,"["" ( GRISSOM , NICK , SARA and a group of other officers start sweeping the area where OLIVER DUNNE 'S body was found . )"", ' ( NICK is pushing a GeoRadar Inc. machine . )', ' ( SARA walks next to him holding a laptop that shows the various items being scanned by the machine . )', ' ( As it approaches various items , the laptop beeps . )', "" [[Nick]] i feel like i 'm mowing a lawn"", ' [[Sara]] what is that ?', ' [[Sara]] a beer can ?', ' [[Sara]] soda can ?', ' [[Nick]] zilch', "" [[Nick]] do n't tell me , more zilch ?"", "" ( On SARA 'S laptop , the figure of a hand appears . )"", ' [[Sara]] whoa ... whoa', ' [[Sara]] point of disturbance', ' [[Grissom]] hold up', "" ( More arm and body appears on the radar 's screen . )"", ' [[Grissom]] isolate it', "" ( Finally , we definitely see the shape of a person 's head . )"", "" ( They 've definitely found a body . )"", ' [[Sara]] grissom', "" ( GRISSOM turns around to look at BENJAMIN JENNINGS standing off in the distance with SGT O'RILEY and three officers . )"", ' ( His face is grim . )', ' ( He makes his way back to BENJAMIN JENNINGS and stops behind him . )', ' [[Grissom]] any more bodies you want to tell me about ?', ' [[Benjamin_Jennings]] no', "" [[Grissom]] we 're going to radar this whole hillside"", ' ( BENJAMIN JENNINGS nods his head . )', "" [[Grissom]] sometimes ... when i leave a crime scene where i 've been particularly involved with a dead body , i sit in my car and it hits me -- how close i was ... how heavy the body is ... the texture of the body ... how it feels ... you know ?"", ' ( GRISSOM leaves to go back to the site and stops when BENJAMIN JENNINGS speaks . )', ' [[Benjamin_Jennings]] mr grissom', "" [[Benjamin_Jennings]] i 'm not a bad person"", ' ( GRISSOM turns around . )', "" [[Grissom]] you 're not a bad person ?"", ' ( BENJAMIN JENNINGS shakes his head . )', ' [[Grissom]] then , what are you ?', ' ( GRISSOM turns and walks away . )']",1,Evidence
11,"[' ( CATHERINE enters and sees DAVID PHILLIPS pushing a gurney toward her down the hallway . )', "" [[Catherine]] oh , i hope that 's shelley danvers the woman from the hotel spa"", "" [[David_Phillips]] yep , she 's next"", "" [[Catherine]] well , it 's about time"", ' [[Catherine]] you guys finished with day-shift runover , huh ?', ' ( DAVID pushes the gurney into the Forensic Autopsy Room . )', ' ( CATHERINE follows him into the room . )', ' [[David_Phillips]] i hate it when you csi guys get territorial', "" [[Catherine]] yeah , well , the victims ' families hate it when we do n't"", "" [[Robbins]] i 'll take it from here , david"", ' [[Catherine]] good morning', ' [[Robbins]] catherine', ' ( ROBBINS lifts up the sheet covering SHELLEY DANVERS . )', ' [[Robbins]] no serosanguineous fluid expunged from the mouth or nose', "" [[Catherine]] she did n't drown ?"", ' [[Robbins]] rules out your jacuzzi theory', ' [[Catherine]] anything probative ?', ' [[Robbins]] bright red lividity extending down the body', ' [[Catherine]] from ?', ' [[Robbins]] well , heatstroke possibly', "" [[Robbins]] stroke could cause multiple organ failure and if i 'm right"", ' [[Catherine]] ... cover-up', ' ( CATHERINE walks out of the room . )', ' [[Robbins]] hey , i still have to do the post', ' [[Robbins]] catherine ?']",1,Death cause
12,"[' ( CATHERINE pulls out her cell phone and dials . )', ' [[Catherine]] brass , i need you to get records from that hotel spa -- a warrant , if we need it', "" [[Catherine]] yep , that 's right"", ' [[Catherine]] bye', ' ( She hangs up just as WARRICK walks to meet her . )', ' ( He turns around when he catches up with CATHERINE . )', "" [[Warrick]] oh , it 's on"", ' [[Catherine]] yeah', ' [[Catherine]] was our girl staying with anyone at that hotel ?', ' [[Warrick]] uh , yeah', ' [[Warrick]] tina ... tina kolas', ' [[Warrick]] best friends from terre haute , indiana', ' [[Warrick]] flew here in a package', ' [[Warrick]] why ?', ' [[Catherine]] we need someone to give us the truth about last night']",1,Perpetrator
13,"[' ( The body is being excavated from the site . )', ' ( NICK is inside the hole with the body and is using a shovel to remove the dirt . )', ' ( GRISSOM stands up above with SARA and other Foresnic personnel . )', ' ( SARA is sifting the dirt around the site looking for evidence . )', ' ( Behind them , FATHER POWELL approaches . )', ' [[Father_Powell]] gil grissom ?', ' [[Grissom]] father ?', "" [[Father_Powell]] benjamin 's a member of my parish"", "" [[Father_Powell]] the officer wo n't let me talk to him"", ' [[Father_Powell]] he said you were in charge', ' [[Grissom]] of this crime scene', ' [[Father_Powell]] he needs spiritual guidance', ' ( GRISSOM glances over at BENJAMIN JENNINGS in handcuffs standing by the police cars with two officers . )', ' ( He glances back down at the dead body and looks back up at FATHER POWELL . )', ' [[Grissom]] yeah , i imagine he does', "" [[Father_Powell]] ah ... then you 'd have no problem with my talking to him"", "" [[Grissom]] it 's the 11th hour"", "" [[Grissom]] i would n't expect anything less"", ' [[Father_Powell]] eleventh hour ?', ' [[Grissom]] when the reality of their actions set in , they usually turn to religion', ' [[Father_Powell]] can you think of a better time ?', ' ( GRISSOM watches as FATHER POWELL walks away to talk with BENJAMIN JENNINGS . )', "" ( GRISSOM turns around and looks at NICK 'S progress . )"", ' [[Grissom]] okay , hold it', "" [[Grissom]] that 's enough"", "" [[Grissom]] let 's dust him"", ' ( NICK puts the shovel aside . )', ' ( SARA puts her stuff aside and grabs the camera . )', ' ( She begins to photograph the body . )', ' [[Nick]] no ligature marks', ' [[Sara]] different from the first guy', "" [[Grissom]] see if this laceration on this guy 's forehead is consistent with the kid 's shovel"", ' [[Nick]] hey', ' [[Nick]] i feel a wallet here', "" ( NICK pulls out the wallet from the dead body 's front pocket and under some folded cash , removes a NEVADA DRIVER LICENSE with the following information: )"", ' [[Nick]] ramirez kenny', ' [[Nick]] a 25-year-old latino and a 42-year-old white guy ?', ' [[Sara]] strangers', "" [[Sara]] does n't make sense"", "" [[Sara]] there 's no connection"", "" [[Grissom]] well , it obviously was n't a robbery"", "" ( SGT O'RILEY approaches . )"", "" [[Sgt._O'Riley]] hey"", "" [[Nick]] hey , o'riley"", "" [[Nick]] what 's the matter , man ?"", ' [[Nick]] a/c not working ?', "" [[Sgt._O'Riley]] i was on with dispatch"", "" [[Sgt._O'Riley]] oliver dunne 's car was just found by the highway patrol abandoned at an avcon station off 215"", "" [[Grissom]] they did n't happen to find another car there , did they ?"", "" [[Sgt._O'Riley]] yeah"", "" [[Sgt._O'Riley]] registered to a 'ramirez '"", ' [[Nick]] yeah ... gas station', ' ( SARA helps NICK out of the ditch , then puts her camera down . )', "" ( They 're off to the gas station . )"", ' ( GRISSOM bends in low to look at the body . )']",1,Victim
14,"[' [[Catherine]] and you can verify that when shelley went to the hotel spa last night , she was going to use the dry sauna ?', "" [[Tina_Kolas]] we 'd been drinking apple martinis for , like , three days straight"", ' [[Tina_Kolas]] shelley said the sauna would detox her you know , clean her out', ' [[Warrick]] cath', ' [[Warrick]] whose shirt is this ?', ' ( WARRICK holds up a pink-colored blouse ripped in the middle . )', ' [[Tina_Kolas]] mine', ' [[Tina_Kolas]] shelley and i got in a fight over it', ' [[Warrick]] when ?', ' [[Tina_Kolas]] yesterday', "" [[Tina_Kolas]] i caught her trying it on and i said 'give it back , ' and then we started fighting over it , you know , tug of war and the whole thing ripped right in two"", ' [[Tina_Kolas]] we fell back laughing', ' ( Quick flashback to the two girls tugging on the shirt . )', ' ( The shirt ripping , and the two girls laughing . )', ' ( End of flashback . )', ' ( Resume on TINA KOLAS . )', "" [[Tina_Kolas]] i 'd give anything to have her back"", "" [[Warrick]] we 're going to take this shirt , if you do n't mind"", "" [[Tina_Kolas]] no , go ahead , if it 'll help"", ' [[Catherine]] you said you have proof that shelley used the dry sauna', ' [[Tina_Kolas]] she called down from this phone', ' [[Tina_Kolas]] do they tape phone calls here ?', ' [[Catherine]] hotel surveillance would love that', "" [[Catherine]] you 're sure she used that phone to make the appointment ?"", ' [[Tina_Kolas]] yeah', ' ( CATHERINE picks up the note pad on the desk next to the phone . )', ' ( She hands it to WARRICK . )', "" ( It 's a blank typical complimentary hotel note pad with light blue logo , name and address of the hotel on it . )"", "" [[Warrick]] we 're going to take this as well"", "" [[Tina_Kolas]] okay ... but it does n't have anything on it"", "" [[Warrick]] well , that 's okay"", ' [[Warrick]] we do magic']",0,None
15,"["" [[Sara]] two men were shot and killed and you did n't see anything ?"", ' [[Kirk_(Avcon_Attendant)]] sorry', "" [[Nick]] you do n't just miss something like that"", ' [[Nick]] what was going on ?', ' [[Kirk]] a friend of mine came with his new car', ' [[Kirk]] we took it for a drive', "" [[Kirk]] i 'm afraid my boss will find out"", ' [[Kirk]] i was only gone five minutes', ' [[Nick]] okay , all right', ' [[Nick]] just-just walk us through it', "" [[Nick]] when did you know there 'd been a crime committed ?"", ' [[Kirk]] well , my buddy dropped me back here and i noticed these two cars', ' [[Kirk]] i went to check them out', ' ( Quick flashback to KIRK walking toward the two cars near the gas pump island . )', ' ( Both driver side doors are open . )', "" ( He reaches the first car and shuts the driver 's door close . )"", "" ( He looks around and does n't see anyone . )"", ' ( He does , however , notice a puddle of blood on the ground . )', ' [[Kirk]] oh , my god', ' ( End of flashback . )', ' ( Resume present . )', "" [[Nick]] i do n't see any blood"", ' [[Kirk]] yeah , i hosed it down', ' [[Sara]] you what ?', "" [[Kirk]] it was freakin ' me out""]",0,None
16,"[' ( Through the plastic sheeting , we see FATHER POWELL enter the CSI Garage . )', "" ( GRISSOM is under the sheeting examining BENJAMIN JENNINGS ' car . )"", "" ( FATHER POWELL approaches the car and puts his hands on the plastic sheeting to see who 's inside the car . )"", ' [[Father_Powell]] h-hello ?', ' [[Father_Powell]] mr grissom ?', ' ( FATHER POWELL lifts up the plastic sheeting and walks underneath it . )', "" [[Father_Powell]] uh ... they told me out front i 'd find you here"", "" [[Grissom]] i do n't see your , uh ... visitor 's badge"", "" [[Father_Powell]] priest 's collar"", ' [[Father_Powell]] people trust it', ' [[Father_Powell]] most people', ' [[Father_Powell]] even ... lapsed catholics', ' [[Grissom]] what makes you think , uh', ' [[Grissom]] i was ever a catholic ?', "" [[Father_Powell]] first time we met , you called me 'father '"", ' [[Father_Powell]] only romans do that', "" [[Father_Powell]] everybody else , it 's 'reverend ' or 'minister '"", ' [[Father_Powell]] i wanted to know how your investigation against ben is going', ' [[Grissom]] this is his car', "" [[Grissom]] you know , you really should n't be here"", "" [[Father_Powell]] i did n't come here to tamper with your evidence"", "" ( GRISSOM puts his goggles back on and starts spraying luminol in the car 's front passenger seat . )"", ' ( As he sprays , the blood evidence begins to glow in the light . )', ' ( GRISSOM collects it . )', ' [[Father_Powell]] he was a good kid , all through school still comes to mass every sunday', "" [[Father_Powell]] if he has a problem ... it 's trying to please people"", ' [[Grissom]] is that a problem ?', ' [[Father_Powell]] it can be', ' ( GRISSOM opens the back door of the Bronco and begins spraying . )', ' ( As he sprays , he recites . )', ' ( FATHER POWELL peers in to see the results . )', ' [[Grissom]] this luminol reveals dried blood', ' ( The blood evidence begins to glow . )', "" ( There 's blood all over the back seat . )"", ' ( FATHER POWELL looks shocked at the evidence he sees . )', "" [[Father_Powell]] he would n't do this"", ' [[Grissom]] i believe the car', "" [[Father_Powell]] 'to whom much is given , much will be expected '"", ' [[Father_Powell]] i leave you to your work', ' ( FATHER POWELL leaves . )']",0,None
17,"[' [[Kim_Marita]] i told you we have no record shelley danvers specifically used the dry sauna', ' ( CATHERINE opens a Las Vegas Metropolitan Police Department Evidence folder with the following information: )', ' ( Date ) 10-25-01 , ( Time ) 08:05 and ( Number ) 48913-5B . )', "" ( She pulls out the note pad taken from SHELLEY DANVERS ' room . )"", "" [[Catherine]] that 's okay , 'cause we do"", "" [[Catherine]] esda can read this blank paper ... see what 's written on it"", ' [[Catherine]] up to 14 layers', ' [[Warrick]] sometimes a simple flashlight will do the trick', ' ( WARRICK pulls out a flashlight and uses it on the pad . )', ' ( We see the following : SAUNA - 8:00 PM . )', "" [[Catherine]] that 's miss danvers ' handwriting"", ' [[Catherine]] we confirm that', ' [[Kim_Marita]] so she took a dry sauna', ' [[Kim_Marita]] what does that prove ?', ' [[Warrick]] she died of a heat stroke', ' [[Warrick]] the coroner just called in with the results of his final post', "" [[Warrick]] your sauna 's kept in the optimal condition for heat stroke -- 182 degrees"", ' ( Quick CGI POV flash to a hand on a thermostat temperature dial twisting it to the right . )', ' ( End of CGI POV . )', ' ( Resume on KIM MARITA . )', ' ( BRASS walks in )', ' [[Warrick]] that could kill a person if you left them longer than two straight hours', ' ( Brass walks in )', ' [[Brass]] especially if no one checks up on them', ' [[Brass]] a hotel employee is supposed to check on the various saunas every 15 minutes', ' [[Brass]] hotel regulations , right ?', ' [[Brass]] we , uh , we got a copy of the check-up sheet', "" ( Camera holds on KIM MARITA 'S look . )""]",0,None
