scene_id,scene_text,in_summary,aspects
0,"[' ( A box is on the autopsy table . )', ' ( ROBBINS cuts the string and cuts the box open . )', ' ( Inside is a large blue plastic tub . )', ' ( ROBBINS takes the tub out and pushes the empty box to the side as he concentrates on the blue tub . )', ' ( He cuts the tape around the cover of the tub and opens the lid . )', ' ( Inside is a head . )', ' [[Robbins]] hmm', ' ( ROBBINS puts his glasses on to examine the head . )', ' ( GRISSOM walks into the room and appears at his side . )', ' [[Grissom]] i heard you got some head', "" [[Robbins]] just came in how 'd you know ?"", ' [[Grissom]] i arranged house seats for david to see celine , so he pages me the minute you get anything perishable', ' [[Robbins]] sellout', ' ( ROBBINS reaches into the tub and removes the head . )', ' ( GRISSOM takes a deep breath . )', ' [[Grissom]] oh ... formaldehyde', ' [[Robbins]] yeah , it fixes tissue , but it destroys dna', ' [[Grissom]] no id through codis', ' [[Grissom]] quite a bit of leaf litter', ' [[Robbins]] puncture wound above the orbital plate', ' [[Grissom]] that looks like animal activity', ' [[Robbins]] heavy decomp', "" [[Robbins]] it 's going to be , uh ... virtually impossible to determine time of death"", "" [[Robbins]] this neck was n't severed"", ' [[Robbins]] it was disarticulated', ' [[Robbins]] no skill involved', ' ( ROBBINS puts the head down on the table and turns it to the left . )', "" ( On the left cheek , there 's a knife cut . )"", ' [[Robbins]] oh-oh', ' [[Robbins]] i take that back', ' [[Grissom]] that took skill', ' ( Quick CGI POV : Camera zooms into the cut - past the skin , into the muscle and flesh . )', ' ( End of CGI POV . )', ' ( Resume to present . )', ' ( ROBBINS turns to look at GRISSOM . )', ' [[Grissom]] the unkindest cut of all', ' [[Robbins]] hmm']",1,Evidence
1,"[' ( DAVID HODGES removes the leaf litter from the head while ROBBINS works on washing the head . )', "" [[David_Hodges]] there 's more plant material here than geological"", ' [[Robbins]] hair roots and scalp are relatively clean', "" [[David_Hodges]] so the vic was n't buried ?"", ' [[Robbins]] you tell me', ' [[David_Hodges]] i will', "" [[David_Hodges]] leaves and needles and dirt -- that 's good as a map"", ' ( CATHERINE walks into the room and up to the table . )', ' ( She frowns when she sees HODGES and ROBBINS working on the head . )', "" [[Catherine]] any idea when grissom 'll be back ?"", ' [[Robbins]] nope', "" [[Robbins]] it 's going to be a while"", ' ( CATHERINE glances down at the paper work in her hand . )', ' [[Catherine]] jackpot , nevada', ' [[Catherine]] where the hell is that ?']",0,None
2,"[' ( The sign says : PAY AT THE PUMP . )', "" ( GRISSOM 'S car travels up the road , past the gas station , and parks next to the Sheriff 's car in the diner parking lot . )""]",0,None
3,"[' ( GRISSOM walks into the diner . )', "" [[Cook]] order 's up , sweetie"", ' ( GRISSOM closes the door behind him . )', "" ( There 's quite a lot of activity in the full diner . )"", ' ( He takes off his glasses and heads for the waitress behind the counter . )', ' [[Grissom]] good morning', "" [[Grissom]] i 'm with the las vegas crime lab , and i"", ' [[Gloria]] hey , alan !', "" [[Gloria]] 's guy 's here about the head"", ' ( GRISSOM looks around . )', "" ( The Sheriff 's sitting at the table and waves him over . )"", ' ( As he heads in that direction , it appears that everyone in the diner already knows about the head . )', ' [[Man]] bet a wolf got him', "" [[Man_2]] there 's no wolves around here dumbass"", ' [[Man_2]] bears', ' [[Man_3]] ten bucks says satanic cult', "" ( GRISSOM approaches the Sheriff 's table . )"", ' [[Alan_Brooks]] lieutenant alan brooks', ' [[Alan_Brooks]] this is my brother leland', ' [[Leland_Brooks]] how do you do ?', ' [[Grissom]] gil grissom , las vegas crime lab', ' [[Grissom]] may i ?', ' [[Alan_Brooks]] have a seat', ' [[Alan_Brooks]] things must be pretty slow in vegas to get one of you guys out here so quick', ' [[Grissom]] well , the elko county sheriff made the request', ' [[Grissom]] we were happy to respond', "" [[Grissom]] it 's an interesting case"", ' [[Alan_Brooks]] mmm , not particularly', ' [[Leland_Brooks]] it was probably some hiker or transient who got lost , took a bad luck fall', ' [[Grissom]] must have been a heck of a fall', "" [[Grissom]] his head 's in a plastic jar"", ' [[Alan_Brooks]] listen , i filed the report', ' [[Alan_Brooks]] i sent in the head', "" [[Alan_Brooks]] five 'll get you ten , there 's not much left of that body out there but coyote turds"", ' ( LELAND chuckles . )', "" [[Alan_Brooks]] look , nobody from this community 's been reported missing"", "" [[Alan_Brooks]] and i just do n't have the resources to go searching for what might be left"", ' [[Grissom]] well , you do now', "" [[Alan_Brooks]] there 'd better be a whole lot more of you out there"", ' ( MARTY COOPERMAN gets up and heads for the door . )', ' [[Alan_Brooks]] have a good one , marty', ' ( MARTY COOPERMAN leaves without saying a word . )', "" [[Grissom]] lieutenant , the preliminary autopsy revealed a single , straight , two-inch cut on the victim 's jaw"", ' [[Grissom]] it was a blade mark', "" [[Grissom]] so , there 's not just a body out there , there 's also a killer""]",0,None
4,"["" ( DAVID HODGES explains what CATHERINE 'S looking at in the scope . )"", ' [[David_Hodges]] of all the plant life gathered from the head , the conifers are the key', ' [[David_Hodges]] the one on the left -- abies zasiocarpa', ' [[David_Hodges]] the one on the right is picea engelmannii , engelmann spruce', ' [[Catherine]] spruce and fir trees', ' [[Catherine]] typical mountain forest', ' [[David_Hodges]] typical for 9,000 feet above sea level', ' [[David_Hodges]] the wood fragments are either cottonwood or aspen', ' [[David_Hodges]] and aspens only grow in areas that have been cleared', ' [[Catherine]] fire , roads or ... logging', ' [[David_Hodges]] after a major forest fire , manzanita bushes grow like weeds for decades', ' [[Catherine]] no manzanita leaves here', ' [[David_Hodges]] which means that the head was on a damp north-facing slope , at least 9,000 feet up , cleared , but not recently exposed to fire']",0,None
5,"[' ( GRISSOM and ALAN BROOKS leave the diner . )', "" ( GRISSOM 'S phone rings . )"", ' ( He answers it . )', ' [[Grissom]] grissom']",0,None
6,"[' [[Catherine]] is the service actually bad out there or are you just keeping your phone off ?', "" [[Grissom]] i 'm sorry"", "" [[Grissom]] i should 've called"", "" [[Catherine]] this trip would n't have anything to do with you ducking case reviews , now would it ?"", ' [[Grissom]] how can you think that ?', "" [[Grissom]] you would n't mind taking care of those for me , would you ?"", ' [[Catherine]] oh , your job , my pay', ' [[Catherine]] why would i care ?', "" [[Grissom]] i 'll make it up to you"", ' [[Catherine]] yeah , you had better', "" ( CATHERINE reaches GRISSOM 'S office and her jaw drops at the stacks of files on his desk that he needs to review . )"", ' ( The desk is a mess . )', "" [[Catherine]] hodges id 'd your leaf litter"", ' [[Grissom]] good', ' [[Grissom]] thanks', ' [[Grissom]] i owe you one', ' ( GRISSOM hangs up . )', ' [[Alan_Brooks]] trouble with the wife ?', ' [[Grissom]] yeah', "" [[Grissom]] she hates it when we 're apart"", ' ( He shrugs . )']",0,None
7,"[' ( GRISSOM interviews SYLVIA ROGERS while ALAN BROOKS watches . )', ' [[Grissom]] so your dog found the head ?', "" [[Sylvia_Rogers]] well , tripper 's not exactly a chihuahua"", ' [[Sylvia_Rogers]] goes where he wants , comes back for dinner', ' [[Sylvia_Rogers]] sometimes he brings dinner back', ' ( Quick flashback to : SYLVIA ROGERS walks out of the house with a dish of food for the dog . )', ' [[Sylvia_Rogers]] tripper !', ' [[Sylvia_Rogers]] come on , buddy , dinner', ' ( She puts the dish down . )', ' ( The dog barks and she looks . )', "" ( She sees he 's playing with the head . )"", ' [[Sylvia_Rogers]] oh , what is it this time , a rabbit or a possum ?', ' ( End of flashback . )', ' ( Resume to present . )', ' [[Grissom]] is he okay ?', ' [[Sylvia_Rogers]] well , he got a little lethargic after chewing on that he took him to the vet , ran some tests', ' [[Sylvia_Rogers]] he got better', ' [[Sylvia_Rogers]] i just want to keep him that way', "" [[Sylvia_Rogers]] where there 's a head there 's got to be hands and feet , and sooner or later , he 'll dig 'em up"", "" [[Alan_Brooks]] or what 's left of 'em"", "" [[Alan_Brooks]] no offense , sylvia , but he 's not exactly a scent hound"", ' [[Grissom]] all animals can smell rotting flesh', ' [[Grissom]] studies have shown that when domestic pets bring back human body parts , usually the remains are within a half-mile radius', ' [[Sylvia_Rogers]] they do studies on that ?', ' [[Grissom]] it occurs more than you think', ' [[Grissom]] have you noticed any buzzards or vultures around ?', ' [[Sylvia_Rogers]] all the time', ' [[Grissom]] thanks', ' ( She leaves . )', ' ( GRISSOM turns and looks at the hillside . )', ' [[Alan_Brooks]] so , are we done here ?', "" [[Grissom]] this slope faces north , does n't it ?"", ' [[Alan_Brooks]] yeah', "" [[Grissom]] you know that old expression , 'heads will roll ' ?"", "" [[Grissom]] it 's true -- especially downhill"", ' ( GRISSOM heads for the north slope . )', ' [[Alan_Brooks]] barry , drop the doughnut', "" [[Alan_Brooks]] you 're gon na earn your pay today""]",0,None
8,"[' ( A couple of OFFICERS walk up the slope . )', ' ( GRISSOM and ALAN BROOKS follow them . )', ' [[Alan_Brooks]] afraid you gon na trip over something ?', "" [[Grissom]] i 'm hoping"", ' [[Grissom]] bodies make good fertilizer', ' [[Grissom]] you often see fresh , green shoots near a gravesite', ' [[Alan_Brooks]] must be nice to know the answer to every little thing', ' [[Grissom]] i prefer questions actually', "" [[Alan_Brooks]] and i do n't , i suppose"", ' [[Alan_Brooks]] remember that waitress , doris ?', "" [[Alan_Brooks]] well , she 's got an ex-husband likes to smack her around every once in a while"", "" [[Alan_Brooks]] high school 's got a dozen meth-heads who like boosting motorcycles and then drag racing 'em down main street , when they think nobody 's watching"", "" [[Alan_Brooks]] fire chief 's a closet pyro , and so forth"", "" [[Alan_Brooks]] see , i do n't have a lot of time to ask questions about buzzards and such"", "" ( He points to the tree GRISOSM 'S looking at . )"", "" [[Alan_Brooks]] that 's an aspen tree , in case you were wondering"", ' ( Up on the hillside the OFFICERS call down to them . )', ' [[Officer]] lieutenant !', ' [[Officer]] over here']",0,None
9,"[' ( GRISSOM reaches the top of the hill and sees the two OFFICERS standing just over the body . )', ' ( One of them is gagging . )', ' [[Grissom]] step away from there , would you please , fellas ?', "" [[Grissom]] do n't disturb the scene"", ' ( They both rush aside as one of the OFFICERS throw up . )', ' ( GRISSOM kneels next to the body . )', ' [[Grissom]] carabid beetles', ' [[Grissom]] second instar maggots', ' ( GRISSOM picks up a bug . )', ' [[Grissom]] formica obscuripes', ' ( Camera zooms in for a close up . )', ' [[Alan_Brooks]] let me guess', ' [[Alan_Brooks]] you like bugs ?', ' [[Grissom]] yeah , i do', "" [[Grissom]] they 're perfect"", ' [[Grissom]] they always do their jobs', ' ( He glances at the Sheriff . )', "" [[Grissom]] this body 's been here four to seven days"", ' ( GRISSOM stands up . )', ' [[Grissom]] how deep would you say this hole is , lieutenant ?', "" [[Alan_Brooks]] i 'd say about four feet , depending on ... how he 's stuffed in there"", "" [[Grissom]] takes a fair amount of dedication to dig a hole this deep up here , do n't you think ?"", ' [[Alan_Brooks]] unless the killer had help', ' [[Grissom]] maybe', ' ( GRISSOM takes a picture of the blood on the rock near the body , then kneels down to look at the spatter . )', "" [[Alan_Brooks]] it 's like you said -- he was cut"", "" [[Grissom]] this blood 's not from a cut"", ' [[Grissom]] the drops imply directionality', ' [[Grissom]] the stellated circles imply', ' ( Quick CGI POV of : The blood spatters on the rock . )', ' [[Grissom]] ... perpendicular impact', ' ( End of CGI POV . )', ' ( Resume to present . )', "" [[Grissom]] this spatter is in direct line with the victim 's carotid"", "" [[Grissom]] it 's arterial spurt"", ' [[Alan_Brooks]] are you saying he was alive when he was buried ?', ' [[Grissom]] i think that the cut we found on his jaw ... was a lure to draw predators', "" ( Quick flashback to : The knife cuts into the victim 's cheek as he screams Cut to : Growling as the animal rushes forward . )"", ' ( The victim screams Cut to : Blood spattering on the rock . )', ' ( End of flashback . )', ' ( Resume to present . )', ' ( GRISSOM and gets to his feet . )', "" [[Grissom]] this was n't just murder"", ' [[Grissom]] it was torture']",1,Crime scene
10,"[' ( GRISSOM looks out at the tree-covered mountainside , waiting . )', ' ( ALAN BROOKS gets impatient . )', ' [[Alan_Brooks]] hey , einstein , we going to stand here all day or what ?', "" [[Grissom]] you 're going to have to be patient , lieutenant"", "" [[Grissom]] the scene has n't been released yet"", ' [[Grissom]] you know , this may be a variation on an old native american form of punishment', ' [[Grissom]] the body was bound and buried up to its neck', ' [[Grissom]] tree sap was poured over the head to attract ants', ' [[Alan_Brooks]] punishment for what ?', ' [[Grissom]] you see ?', "" [[Grissom]] that 's a good question"", ' ( DALE STERLING appears on the hill , huffing and puffing with exertion . )', "" [[Alan_Brooks]] it 's about time , dale"", ' ( DALE STERLING looks at the body in the ground . )', ' [[Grissom]] you are the coroner , i presume', ' [[Dale_Sterling]] mr grissom', ' [[Dale_Sterling]] dr dale sterling', ' [[Dale_Sterling]] i sent you the head', ' [[Dale_Sterling]] how can i help ?', "" [[Grissom]] well , we ca n't touch the body until you authorize it"", ' [[Dale_Sterling]] oh', ' ( DALE STERLING looks at ALAN BROOKS , then he looks over at the other OFFICER . )', ' ( They all look puzzled by this . )', ' ( Game , DALE STERLING looks down at the body . )', "" [[Dale_Sterling]] he 's dead"", "" [[Dale_Sterling]] you 're authorized"", ' [[Alan_Brooks]] thanks , doc', "" [[Alan_Brooks]] that 's nice work"", ' [[Alan_Brooks]] can we get it out now ?', ' [[Grissom]] there may be evidence in the gravesite', ' [[Grissom]] we need to preserve it', ' [[Alan_Brooks]] okay , so what do you want to do , call your lab ?', ' [[Alan_Brooks]] have them send the right gear , the right guys , what ?', "" [[Grissom]] the site 's already been compromised"", "" [[Grissom]] we 'll make do with what we have here"", "" [[Grissom]] now , for each foot of dirt that 's removed , go on a separate bag"", "" [[Grissom]] i 'll sift through it later"", ' [[Alan_Brooks]] all right', ' [[Alan_Brooks]] out of the way , doc', ' [[Alan_Brooks]] pardon me', ' [[Grissom]] hold on', "" [[Grissom]] make sure your shovels do n't get within six inches of that body"", ' [[Alan_Brooks]] can we please get on with getting him out of there ?', "" [[Alan_Brooks]] we 're losing light"", ' ( They start to dig the body out . )']",0,None
11,"[' ( GRISSOM faces the wall with a degree on it from : THE UNIVERSITY OF VETERINARY STUDIES for DALE STERLING . )', ' ( DALE STERLING takes off his jacket and sees GRISSOM looking at the wall . )', ' [[Dale_Sterling]] i was in the 99th percentile on the mcats', ' [[Dale_Sterling]] i could have gone to med school', ' [[Dale_Sterling]] i chose to be a vet', "" [[Grissom]] well , veterinary school 's harder to get into than medical school"", "" [[Grissom]] that 's not what i was looking at"", ' [[Grissom]] this is you and that gal from the diner', ' [[Dale_Sterling]] doris', ' [[Dale_Sterling]] we were married', ' [[Dale_Sterling]] high school sweethearts', "" [[Dale_Sterling]] did n't work out"", ' ( The body is put on the examining table . )', ' [[Dale_Sterling]] i know how to cut', ' [[Dale_Sterling]] i could', ' [[Dale_Sterling]] i could do the autopsy right here', ' [[Grissom]] only a licensed pathologist can perform an autopsy', "" [[Grissom]] all we 're allowed to do is search for evidence on the body"", ' [[Alan_Brooks]] and then what ?', ' [[Grissom]] then we take it to vegas', ' [[Grissom]] tonight', "" [[Grissom]] we 'll need someone to drive the body"", ' ( BARRY is just about to sit down , when ALAN BROOKS looks at him . )', "" [[Alan_Brooks]] barry , it 's your lucky day"", ' [[Alan_Brooks]] get your car', ' [[Alan_Brooks]] come on', ' [[Grissom]] our medical examiner will send you his report', "" [[Grissom]] you 'll need to sign the death certificate as to cause and manner of death"", ' ( GRISSOM looks around at the body . )', ' ( DALE reaches into the pants pocket . )', ' [[Dale_Sterling]] no wallet and no id', ' ( GRISSOM pulls out a ball of paper from the other side pants pocket . )', ' [[Dale_Sterling]] what have you got there ?', "" [[Grissom]] well , i 'm not sure yet"", ' ( ALAN BROOKS settles in and waits while they gather evidence . )', ' ( GRISSOM checks the wrists and ankles . )', ' [[Grissom]] no ligature marks', "" [[Dale_Sterling]] well , he was n't tied up ?"", ' [[Grissom]] apparently not', ' [[Dale_Sterling]] well , no one just lets themselves get buried alive', ' [[Grissom]] well , maybe the killer had a gun on him', "" [[Alan_Brooks]] well , you ca n't dig a hole and hold a gun on an unbound victim all at the same time"", ' [[Dale_Sterling]] well , maybe the hole was dug earlier ?', ' [[Grissom]] that would imply premeditation', ' [[Alan_Brooks]] or more than one killer', ' [[Dale_Sterling]] maybe the victim was drugged', "" [[Grissom]] sylvia rogers ' dog got sick after chewing on the victim 's head , correct ?"", "" [[Dale_Sterling]] that 's right"", ' [[Grissom]] did you do blood work ?', ' [[Dale_Sterling]] i sent it off to a lab in reno', ' [[Dale_Sterling]] still waiting for the results', ' [[Grissom]] call the lab', ' [[Grissom]] have them do a full drug and tox panel on the blood', "" ( DALE leaves the room as GRISSOM takes the body 's fingerprints . )"", ' ( ALAN BROOKS watches . )', "" [[Grissom]] maybe whatever was in this man 's body is also in the dog 's""]",0,None
12,"[' ( The SHERIFF and his men put the body in the back seat of the car . )', "" ( They 're about to close the door when GRISSOM stops them . )"", ' [[Grissom]] hold on a second , fellows', ' ( GRISSOM puts a tie on the zipper of the bag sealing it shut . )', ' ( ALAN BROOKS looks at his watch . )', ' ( GRISSOM takes a picture of the tie . )', ' ( Done , he backs out and lets them close the back door . )', ' [[Grissom]] okay', ' ( GRISSOM then takes a picture of BARRY , the driver . )', ' [[Grissom]] say cheese', ' [[Alan_Brooks]] oh , what the hell was that for ?', ' [[Grissom]] souvenir', "" [[Alan_Brooks]] why , is that french for 'evidence ' ?"", ' [[Alan_Brooks]] straight drive , barry', ' [[Alan_Brooks]] stay out of the casinos', ' [[Barry]] you got it , boss', "" ( BARRY heads for the driver 's seat . )"", ' [[Alan_Brooks]] you boys have a good night', ' ( ALAN BROOKS walks past DALE STERLING and GRISSOM as the car with the body moves away . )', ' [[Dale_Sterling]] man', ' [[Dale_Sterling]] it was one hell of day', ' [[Dale_Sterling]] you need a place to sleep ?', ' [[Grissom]] i need a place to work']",0,None
13,"["" ( CLOSE UP : GRISSOM sprays the wad of paper he removed from the victim 's pants pocket . )"", ' ( He slowly and carefully pries it open . )', ' ( He hears a door opening and closing . )', ' ( GRISSOM looks up and slowly reaches for his gun . )', ' ( He puts the gun on the desk within easy reach , then goes back to work on the paper . )']",0,None
14,"[' ( CATHERINE receives a fax and looks at it . )', "" ( WARRICK appears in the doorway and looks at CATHERINE behind GRISSOM 'S desk . )"", ' [[Warrick]] did i miss a memo or something ?', ' [[Catherine]] oh , no', "" [[Catherine]] grissom 's on a safari"", "" [[Warrick]] he 's got you pushing his paperwork , huh ?"", "" [[Catherine]] i 'm trying to avoid that"", ' [[Catherine]] his headless d.b', ' [[Catherine]] had a western lvu bookstore receipt in his pocket', ' [[Catherine]] grissom just unraveled it', ' [[Warrick]] really ?', ' ( WARRICK walks into the office . )', ' [[Catherine]] wow !', ' [[Catherine]] some of these books are a hundred bucks a pop', "" [[Catherine]] tuition , plus room and board -- that 's at least another 10k"", ' [[Warrick]] you got to have money to go to college these days', ' [[Catherine]] yeah , well , i missed that boat', ' [[Catherine]] so , most of these are freshman textbooks', ' [[Catherine]] core curriculum', "" [[Warrick]] well , that 's at least two thousand students"", "" [[Warrick]] maybe you 'll get lucky with the victim 's prints"", ' [[Catherine]] oh , wait', ' [[Catherine]] hang on', "" [[Catherine]] 'chiaroscuro theory and technique '"", "" [[Catherine]] it 's a sophomore-level fine arts text"", ' [[Warrick]] freshman in a sophomore course ?', ' [[Catherine]] narrows the field']",0,None
15,"["" [[Brass]] actually , we 're here about your roommate,"", ' ( BRASS and CATHERINE question ERIC BROOKS . )', ' [[Brass]] ... ross jenson', ' [[Brass]] do you know where we can find him ?', "" [[Eric_Brooks]] uh , i actually have n't even seen him since last friday"", ' [[Eric_Brooks]] i had wheezer tickets , and we were supposed to go , but he , uh , he blew me off', ' [[Brass]] gone almost a week', ' [[Brass]] that normal ?', "" [[Eric_Brooks]] yeah , he 's an art student , you know"", ' [[Eric_Brooks]] he goes off a lot , and for days sometimes', ' [[Brass]] huh', "" [[Eric_Brooks]] i 've been , uh , studying my ass off for this american history midterm , but , uh , feel free to have a look around"", "" ( BRASS finds some drugs in an ALTOID 'S container . )"", "" [[Eric_Brooks]] that 's not mine"", "" [[Eric_Brooks]] i do n't know what that is"", ' [[Brass]] relax , buddy', ' [[Brass]] this is a homicide investigation', ' ( CATHERINE sees the shoes and dirt in the closet . )', "" [[Catherine]] are these ross 's shoes ?"", "" [[Eric_Brooks]] i do n't know"", ' [[Brass]] what do you got ?', ' [[Catherine]] aspen leaf', ' [[Catherine]] a little piece of the countryside', ' [[Catherine]] has ross spent a lot of time up in northern nevada ?', ' [[Eric_Brooks]] yeah , he liked the scenery up there', "" [[Brass]] we 're going to need to take that computer and a few things back to the lab"", ' [[Eric_Brooks]] okay']",1,"Victim,Perpetrator"
16,"[' ( GRISSOM is lying on the office couch with his jacket around him as a blanket . )', ' ( The fax prints out some information . )', ' ( GRISSOM is startled awake and he gets up . )', ' ( In his hand , under his jacket he has his gun . )', ' ( He puts the gun on the table and grabs the fax printout . )', ' ( It reads: )', ' ( On the bottom of the sheet , CATHERINE wrote: )']",0,None
17,"[' ( GRISSOM talks with GLORIA . )', ' [[Gloria]] yeah', ' [[Gloria]] came in here last week', ' [[Gloria]] handsome boy', ' [[Gloria]] nice clothes', ' [[Gloria]] just passing through', ' ( Quick flashback to : GLORIA talks with ROSS JENSON . )', "" [[Gloria]] there 's , uh , fried chicken , me"", "" [[Ross_Jenson]] coffee 's about all i can handle right now"", ' [[Ross_Jenson]] maybe some other time , okay ?', ' ( End of flashback . )', ' ( Resume to present . )', "" [[Woman]] guess you were n't his type"", "" [[Customer_(man)]] was n't he the guy driving that gutless little four-banger ?"", ' [[Grissom]] what kind of car was it ?', "" [[Customer_(man)]] do n't know"", "" [[Customer_(man)]] kid 's car"", ' [[Customer_(man)]] something to drive around the city', "" [[Customer_(man)]] it 's no good for hills"", ' [[Customer_(man)]] black , or , what , blue , maybe', ' [[Grissom]] lieutenant ?', ' [[Alan_Brooks]] yeah', ' [[Grissom]] the victim was on his way out of town', "" [[Grissom]] we know he did n't get very far"", "" [[Grissom]] so where 's his vehicle ?"", ' [[Alan_Brooks]] anybody here seen a black or blue mystery vehicle ?', ' [[Customers]] no', ' [[Customers]] customers : uh-uh', ' [[Customers]] customers : no', "" [[Alan_Brooks]] well , i 'd say that car 's long gone by now"", ' [[Grissom]] if the killer was a local , he could have ditched the car somewhere near here', ' [[Alan_Brooks]] do you have a local suspect ?', "" [[Grissom]] it 's a theory"", ' [[Alan_Brooks]] oh', "" [[Grissom]] and like any theory , it does n't mean anything unless you can prove it"", ' [[Grissom]] may i borrow this ?', ' ( GRISSOM pulls the paper place mat with a map of the area toward him . )', ' [[Grissom]] the victim was last seen here , right ?', ' ( GRISSOM marks up the map . )', ' [[Alan_Brooks]] yeah', "" ( CUSTOMERS at the counter crane their necks to see what GRISSOM 'S doing . )"", ' [[Grissom]] we found his body here', ' [[Alan_Brooks]] mm-hmm', ' [[Grissom]] this is the only way out of town', ' [[Grissom]] the killer had to intercept him somewhere along this road', ' [[Alan_Brooks]] knock yourself out']",0,None
