scene_id,scene_text,in_summary,aspects
0,"[' ( Martha Krell rolls her bag to the front desk . )', ' ( The Front Desk Clerk looks at her . )', ' [[Front_Desk_Clerk]] welcome back , mrs krell', "" [[Martha_Krell]] i told you , it 's martha"", ' ( She takes her card . )', "" [[Front_Desk_Clerk]] your room 's ready and i have your credit card on file"", ' ( She turns to her co-workers as she leaves . )', ' [[Martha_Krell]] see you in the morning', "" [[Martha_Krell]] i 'm beat"", ' ( The elevator door opens . )', ' ( She walks inside and presses the button . )', ' [[Front_Desk_Clerk]] call me if you need anything , martha', ' ( She smiles as the elevator doors close . )', ' ( The Front Desk Clerk looks up . )', ' ( The elevator light for the second floor lights up . )']",1,Victim
1,"[' ( The stairwell door opens and a man in a dark-colored jacket steps out . )', ' ( He looks down the hallway one way , then notes the EXIT door down the other hallway . )', ' ( Off screen , the elevator bell dings . )', ' ( The man in the dark-colored jacket and white sneakers heads toward the EXIT door . )', ' ( He follows the hallway and sees Martha Krell heading down the hallway with her luggage in tow . )', ' ( He starts walking quickly and purposefully toward her . )', ' ( Martha Krell reaches the motel room door and uses the card key to unlock the door . )', ' ( The man reaches Martha Krell quickly . )', ' ( He swiftly grabs her and pushes his way into her motel room , her scream muffled by his hand over her mouth . )', ' ( Brass , Grissom and Sara walk into the room . )', ' ( Officers are there . )', "" [[Brass]] decedent 's name is martha krell"", ' [[Brass]] flight attendant', ' [[Brass]] she checked in this afternoon', ' ( Brass stops near the bed where Martha is dead on the bed , her blood seeping into the sheets . )', ' [[Brass]] apparently , she was stabbed to death', "" [[Brass]] the coroner 's en route"", ' ( Grissom and Sara put their kits down . )', ' [[Grissom]] weird ... no sign of struggle', ' ( They look around the room . )', ' [[Brass]] no clothes , no luggage', "" [[Sara]] bedspread 's undisturbed"", ' [[Sara]] trashcan is empty and the inside is spotless', "" [[Sara]] it 's possible a liner 's been removed"", ' ( Grissom looks at the dead body . )', ' [[Brass]] take a whiff', ' [[Grissom]] smells clean', ' [[Brass]] smells like a hospital', ' [[Sara]] bleaches and deodorizers', ' [[Sara]] killer attacked the victim , then cleaned and sanitized the room', "" [[Grissom]] ah , but here 's the smell of the blood still , and all the perfumes in arabia will not sweeten this little room""]",1,Crime scene
2,"[' ( Officer car lights flash . )', ' ( Close-up : The DFP450 thermometer gage reads 83 degrees . )', ' ( David Phillips removes it from the liver . )', ' ( A camera snaps and flashes . )', "" [[David_Phillips]] her liver temp 's 83 degrees"", "" [[David_Phillips]] she 's been dead approximately ten hours"", ' ( Sara is taking picture of the body . )', "" [[Sara]] i 'd like to get a clear photo of her wounds"", ' [[Sara]] can we lay her out ?', ' [[David_Phillips]] oh , yeah', ' [[David_Phillips]] grab her feet', ' ( Sara puts her camera down . )', "" ( She grabs the feet while David holds on to the victim 's upper body . )"", ' ( As they flatten the body out , we hear the joints cracking . )', "" ( David picks up the victim 's bloodied hand and looks at it . )"", ' [[David_Phillips]] defensive wounds', ' ( Sara picks up her camera and takes more photos . )', ' [[David_Phillips]] incised', ' ( He looks down the body at the stab wounds . )', ' ( Sara snaps more photos . )', ' [[David_Phillips]] at least a dozen', ' [[Sara]] she did not want to die', ' ( Off screen , the motel room door opens . )', ' ( Greg walks in with his kit . )', ' [[Greg]] i just got the call', ' ( Sara turns and looks at Greg . )', "" [[Greg]] where 's grissom ?"", ' [[Sara]] bathroom', ' ( Greg tilts his head , puzzled . )', ' [[Sara]] working the , uh , case', ' ( Greg heads for the bathroom . )']",0,None
3,"[' ( Greg walks into the bathroom and finds Grissom sitting in the tub holding his flashlight down at the drain )', ' [[Greg]] hey', ' [[Grissom]] hand me my multi-tool , will ya , greg ?', ' [[Grissom]] i need a phillips', "" ( Greg puts his kit down and picks up Grissom 's multi-tool . )"", ' ( He takes out the Phillips screwdriver and hands it to Grissom . )', ' ( Grissom takes the tool and starts unscrewing the drain )', ' [[Greg]] what are you doing ?', ' [[Grissom]] well , the stabbing was brutal , but the crime scene is clean', ' [[Grissom]] no cast-off , no spatter', ' [[Grissom]] so , i want to know if the killer washed blood down the drain', ' ( Grissom removes the drain cover . )', ' ( He holds it up and looks at its underside with his flashlight . )', ' ( He puts it aside . )', ' ( He uses the forceps and removes a wad of hair in the drain He holds it up and looks at it with his flashlight . )', ' [[Grissom]] swab and phenol this , will ya ?', "" ( Greg takes a swab from Grissom 's open kit on the toilet and kneels down to swab the wad of hair . )"", ' ( He tests it with phenol and the swab tip turns pink . )', ' [[Greg]] blood', ' ( Grissom holds out the wad of hair for Greg to take . )', ' [[Grissom]] label it', ' [[Grissom]] send it to dna', ' ( Greg takes the forceps from Grissom . )']",0,None
4,"[' ( Close-up of : Martha Krell is on the gurney . )', ' ( The coroner covers her with a sheet . )', ' ( Grissom steps out of the bathroom . )', "" ( He removes his latex gloves and watches as the coroner wheels out the victim 's body . )"", ' ( He heads over to Sara . )', ' ( Sara is dusting the hotel table . )', ' ( Grissom stops and stands next to her . )', ' [[Sara]] usually in hotel rooms , we find too many prints', ' [[Sara]] not a single one', ' [[Sara]] just wipes and swipes']",0,None
5,"[' ( Brass interviews the Front Desk Clerk . )', ' [[Front_Desk_Clerk]] ms krell was a real nice lady', ' [[Front_Desk_Clerk]] she brought me a dodger baseball cap', ' [[Brass]] wow', ' [[Brass]] so you were friends ?', ' [[Front_Desk_Clerk]] not really', ' [[Front_Desk_Clerk]] airlines buy a chunk of rooms for their trolley dollies , discounted', "" [[Front_Desk_Clerk]] she 's just staying here for a few months"", ' [[Brass]] so you discovered the body', ' [[Front_Desk_Clerk]] her supervisor called to say her a.m. flight was canceled', "" [[Front_Desk_Clerk]] she was n't answering her phone"", ' [[Front_Desk_Clerk]] he asked me to make sure she got the message', "" [[Brass]] so you knocked on her door , and when she did n't answer , you just went right in ?"", ' [[Front_Desk_Clerk]] yeah', ' [[Front_Desk_Clerk]] i got a master key', ' [[Brass]] yeah , i knew that', ' [[Brass]] does the hotel have surveillance ?', ' [[Front_Desk_Clerk]] nope', ' [[Brass]] thank you', "" [[Brass]] you 've been a big help"", ' [[Front_Desk_Clerk]] right on', ' ( The Front Desk Clerk leaves . )', ' ( Hayden Michael steps up toward Brass . )', ' [[Hayden_Michaels]] excuse me', "" [[Hayden_Michaels]] i 'm hayden michaels"", "" [[Hayden_Michaels]] i 'm the manager of the four aces"", ' [[Hayden_Michaels]] i just got the call', ' [[Hayden_Michaels]] anything we can do to help ?', ' [[Brass]] thank you', "" [[Brass]] i 'll let you know"", ' [[Hayden_Michaels]] detective , if this hits the media , this is really going to hurt our business', ' [[Brass]] what are you asking me ?', ' [[Hayden_Michaels]] anything you can do to keep it out of the press ?', "" [[Brass]] look , i 'm trying to catch a killer"", ' [[Brass]] i got no control over the press', ' [[Brass]] if this makes the news , then it is what it is', ' ( Brass turns and leaves . )']",1,Perpetrator
6,"[' ( Officers put up crime scene tape around the front of the house . )', ' ( Catherine and Nick exit their vehicle and head for the house carrying their kits . )', ' ( They pass an officer escorting Martin Hawkins out the front walk , another officer escorting Yvonne Hawkins and a third officer escorting their son , Matthew Hawkins . )', ' ( The officer opens the back seat car door for Martin Hawkins . )', ' ( Catherine passes Matthew Hawkins on her way to the house . )', ' ( Detective Chris Cavaliere meets up with Catherine and Nick . )', ' [[Det._Chris_Cavaliere]] hey', "" [[Det._Chris_Cavaliere]] victim 's in the bedroom"", ' [[Det._Chris_Cavaliere]] ty hawkins , 12', ' ( He leads them into the house . )']",1,Crime scene
7,"[' ( David Phillips removes the thermometer and puts the sheet down . )', ' [[Det._Chris_Cavaliere]] mother came in to wake him ... found him like this', ' ( Det Cavaliere , Nick and Catherine look at the little boy bruised and beaten under the bed sheet . )', ' ( Nick sighs . )', ' [[Nick]] beaten to death', ' [[Det._Chris_Cavaliere]] this many blows ; it was personal', ' [[David_Phillips]] liver temp makes t.o.d', ' [[David_Phillips]] around midnight', ' [[Det._Chris_Cavaliere]] no sign of forced entry', "" [[Det._Chris_Cavaliere]] nothing 's missing"", ' [[Det._Chris_Cavaliere]] all the doors and windows were locked except for the screen door', ' [[Det._Chris_Cavaliere]] parents claim they keep that locked', ' [[Catherine]] you find a weapon ?', ' [[Det._Chris_Cavaliere]] negative', "" [[Det._Chris_Cavaliere]] family 's been transported down to the station"", "" [[Det._Chris_Cavaliere]] i 'm gon na go down and take their statement"", "" [[Det._Chris_Cavaliere]] hey , when you 're done here , roll by"", "" [[Det._Chris_Cavaliere]] we 'll ink them"", ' [[Nick]] you got it', ' ( Det Cavaliere leaves . )', "" [[Catherine]] boy 's not even safe in his own bed"", ' ( Nick sighs again )', "" [[Catherine]] i 'll take the inside"", ' [[Nick]] yeah , i could use the fresh air']",1,Death cause
8,"["" ( Catherine takes a swab of Ty Hawkins ' bed . )"", ' ( She picks up the bat and looks at the knob at the base of the bat handle . )', ' ( She swabs the head of the bat . )', ' ( She puts the bat down and tests it . )', ' ( Negative . )', ' ( She looks at the swab . )', ' ( Catherine removes the sheets off the bed . )', ' ( Camera pulls back out of the bedroom through the bedroom window and out of the house ... )', "" ( ... where Nick is standing with his camera to take a photo of the shoe print in the dirt just outside Ty Hawkins ' bedroom window . )"", ' ( He puts the ruler aside and puts a metal ring around the shoe print . )', ' ( He smashes the bag of plaster and pours it over the shoe print . )', ' ( Nick stands up . )', ' ( Camera zooms back into the house through the bedroom window ... )', ' ( ... where Catherine is standing near the shelves dusting them for prints . )', "" ( Nick has found the word 'BRAT ' written on the bedroom window . )"", ' ( He dusts it . )', ' ( Inside , Catherine dusts the window jalousies . )', ' ( Outside , Nick dusts the word on the window glass . )', ' ( He leans in close and snaps a photo of it . )', ' ( Catherine walks into the utility room and opens the washer . )', ' ( She takes out some bed sheets and other clothing . )', ' ( She uses an ALS on the clothes and finds some urine stains on the clothing and the bed sheets . )', ' ( Nick walks over to the trash bins . )', ' ( On the ground are some heavy lead pipes . )', ' ( He snaps photos of it . )', ' ( He picks one up and looks at the treading at the bottom . )', ' ( He puts the pipe down and snaps a photo of it . )', ' ( Catherine opens the back of their SUV . )', ' ( She takes her sunglasses off . )', ' ( Nick walks up to her carrying a lead pipe . )', ' [[Nick]] found a pile of pipes by the side of the house ; one seems to be missing', ' [[Nick]] this is an exemplar of a possible murder weapon', "" [[Nick]] and i cast a shoe impression just outside the kid 's bedroom window"", ' [[Nick]] also some graffiti on the window -- b-r-a-t. maybe somebody had it in for the kid', ' ( Catherine slips her jacket on . )', ' [[Catherine]] well , i bagged the bloody sheets from the bed', ' [[Catherine]] found boxers , a t-shirt and a fitted sheet in the washer', "" [[Catherine]] als 'd for blood , found urine"", ' [[Nick]] mm', ' [[Nick]] well , whoever killed the boy knew how to get in and out of this house without waking the family', ' ( Catherine closes the back door . )']",0,None
9,"["" ( Robbins goes over Martha Krell 's body with Grissom . )"", ' [[Robbins]] no mystery here', ' [[Robbins]] ms krell was violently stabbed to death', ' [[Robbins]] c.o.d', ' [[Robbins]] exsanguination', ' [[Grissom]] sae kit ?', ' [[Robbins]] she was raped', ' [[Robbins]] contusions to the vaginal introitus and an eighth-inch hemorrhagic laceration at the vaginal fourchette', "" [[Robbins]] six o'clock position"", ' [[Robbins]] the attack was brutal', "" [[Grissom]] are n't they always ?"", "" [[Grissom]] i do n't know why people think that rape has anything to do with s*x"", ' [[Robbins]] if a guy just wants s*x , he can hire a hooker', ' [[Grissom]] what else ?', ' [[Robbins]] well , there is some good news', ' [[Robbins]] motile sperm in the t mount', "" [[Robbins]] i 've sent the kit to dna for analysis""]",1,Death cause
10,"[' ( Open on the writing on the side of a file storage box: )', ' ( Sara walks to the office and lingers in the doorway . )', "" [[Sara]] ecklie , what 's up ?"", ' ( Ecklie looks at Sara . )', ' [[Conrad_Ecklie]] i paged grissom', ' ( Sara walks into the office . )', ' [[Sara]] and he paged me', ' [[Sara]] how can i help you ?', ' [[Conrad_Ecklie]] five years ago , there was this , uh , day-shift case , homicide', ' [[Conrad_Ecklie]] the victim was a flight attendant named sue stein from palo alto , california', ' [[Conrad_Ecklie]] she was raped and murdered in a local hotel', ' [[Conrad_Ecklie]] killer was never apprehended', ' ( Camera focuses in on a particular photo of the victim . )', "" ( She 's dressed in her underwear and on her side on the bed . )"", ' ( A similar scene to the one she just left . )', "" ( Quick flashback to : [_FOUR_ACES_MOTEL_-_DAY_] David Phillips is standing over the victim 's body while Sara snaps photos of her . )"", ' ( End of flashback . )', ' ( Resume to present . )', "" ( CU : Sara 's eyes . )"", ' ( She looks at the photos on the table . )', "" ( The crime scene from five years ago is very similar to the one they 're investigating . )"", ' ( The victim is on the bed bloodied from stab wounds . )', ' ( There are defensive cuts on her left hand . )', "" ( Quick flashback to : [_FOUR_ACES_MOTEL_-_DAY_] David Phillips lifts up Martha Krell 's bloodied right hand . )"", ' ( End of flashback . )', ' ( Resume to present . )', ' ( Camera pans over the photos of the immaculate motel room from five years ago . )', ' ( Quick flashback to : [_FOUR_ACES_MOTEL_-_DAY_] Camera moves over the table wiped clean . )', ' ( End of flashback . )', ' ( Resume to present . )', "" ( CU : Sara 's eyes . )"", ' ( She looks at the photos on the table . )', ' ( Ecklie looks at Sara . )', "" [[Conrad_Ecklie]] vic 's clothing and suitcase were missing"", ' [[Conrad_Ecklie]] room was immaculate , smelled like disinfectant', ' [[Sara]] same signature', ' [[Conrad_Ecklie]] one difference', ' [[Conrad_Ecklie]] in the , uh , prior case , body was found in a first floor room', ' [[Conrad_Ecklie]] sliding glass door facing the pool was unlocked', ' [[Sara]] ms krell was killed on the second floor', ' [[Sara]] there was only one way into her room', ' ( Ecklie nods . )', "" [[Sara]] was there semen present in sue stein 's sae kit ?"", ' [[Conrad_Ecklie]] yeah', ' [[Conrad_Ecklie]] ran it through codis', ' [[Conrad_Ecklie]] no hit', ' [[Conrad_Ecklie]] i asked mia to compare it with the semen from the recent attack', ' [[Sara]] is that fingerprint from your crime scene ?', ' ( Ecklie hands the print tape and photo to Sara . )', ' [[Conrad_Ecklie]] only print we found', "" [[Conrad_Ecklie]] impressed in sue 's blood on the bedspread near her hips"", ' [[Conrad_Ecklie]] underlying pattern on the fabric made it impossible to read', ' [[Sara]] that was then', ' [[Sara]] this is now']",0,None
11,"[' ( Nick fingerprints Martin Hawkins . )', "" [[Martin_Hawkins]] my son 's dead"", ' [[Martin_Hawkins]] why are you fingerprinting me ?', ' [[Nick]] the crime lab is going to dust your house for prints , so i need to know which ones are yours', ' ( Nick rips open a towel wipe and hands it to Martin Hawkins . )', ' ( Det Chris Cavaliere questions Martin Hawkins . )', ' [[Det._Chris_Cavaliere]] now , your wife said that you both went to bed after the news', ' [[Martin_Hawkins]] i already told you that', ' [[Martin_Hawkins]] twice', ' ( Martin Hawkins nervously wipes his ink-stained fingertips on the towelette . )', ' [[Martin_Hawkins]] you know , i', ' [[Martin_Hawkins]] i got questions , too , you know', ' [[Martin_Hawkins]] why ty ?', ' [[Martin_Hawkins]] why not me ?', ' ( Nick looks at Det Cavaliere . )', ' [[Martin_Hawkins]] how could my wife and i sleep', ' [[Martin_Hawkins]] ... through it all ?', ' [[Nick]] mr hawkins , would you stand up , facing me , so i can take some photos ?', ' [[Martin_Hawkins]] is this really necessary ?', ' [[Det._Chris_Cavaliere]] please , just let him do his job', ' [[Det._Chris_Cavaliere]] sir', ' ( Martin Hawkins stands up . )', ' ( Nick raises his camera and snaps several photos - from his face down to his shoes . )', ' ( Martin Hawkins glances over at Det Cavaliere . )', ' ( Det Cavaliere looks away . )', ' ( Nick takes out a swab . )', ' [[Nick]] open up', ' ( Nick holds out a swab . )', ' ( Martin Hawkins opens his mouth . )', ' ( Nick swabs the inside of his mouth . )', "" [[Nick]] i 'll be needing to take your shoes as well"", ' [[Nick]] you can wear some booties home', ' [[Martin_Hawkins]] what now ?', ' [[Det._Chris_Cavaliere]] you and your wife are free to go', ' [[Martin_Hawkins]] what about matt ?', ' [[Det._Chris_Cavaliere]] he has to stay here in protective custody until this is resolved', ' ( Det Cavaliere glances at Nick . )', ' ( Martin Hawkins glances at Nick . )', ' ( Nick nods . )']",0,None
12,"[' ( Yvonne Hawkins sits in the hallway chair waiting . )', ' ( Martin Hawkins walks out and sees her . )', ' [[Martin_Hawkins]] yvonne ?', ' [[Martin_Hawkins]] hey', ' ( They hug . )', ' ( Det Cavaliere waits in the back . )', "" [[Yvonne_Hawkins]] they 're keeping matt"", ' [[Martin_Hawkins]] i know', "" [[Martin_Hawkins]] he 'll be home soon"", "" [[Martin_Hawkins]] it 's just procedure"", ' [[Martin_Hawkins]] right ?', ' ( Det Cavaliere nods . )', ' [[Det._Chris_Cavaliere]] right', ' [[Martin_Hawkins]] can we at least speak to him ?', "" [[Det._Chris_Cavaliere]] ca n't allow that"", ' ( Yvonne Hawkins turns and looks at Matthew sitting in the waiting room nursing a can of something to drink . )', ' ( She turns back and looks at Robert . )', "" [[Martin_Hawkins]] come on , let-let 's go"", ' [[Martin_Hawkins]] come on', ' ( Nick walks out and watches them . )', ' ( Martin and Yvonne Hawkins leave . )', ' ( Matthew waves to them as they go . )', ' ( Nick looks at Det Cavaliere . )', ' [[Nick]] you just gon na let them go ?', ' [[Det._Chris_Cavaliere]] neither has a record , no motive', "" [[Det._Chris_Cavaliere]] there 's no blood on them"", "" [[Nick]] well , they could 've showered , tossed their clothes"", ' [[Det._Chris_Cavaliere]] their grief is not an act', ' [[Nick]] yeah , based on what ?', ' [[Det._Chris_Cavaliere]] years of listening to the parents of dead children', "" [[Det._Chris_Cavaliere]] let 's go talk to this kid""]",1,Perpetrator
13,"[' ( Greg walks into the lab . )', ' ( Mia is at the counter working . )', "" ( She does n't look up when he stops near her . )"", ' [[Greg]] hey , mia', "" ( He notices that she 's got earplugs on . )"", ' ( He waves a hand in front of her face to get her attention . )', ' ( She takes the earplugs out . )', "" [[Greg]] let me guess ; you 're listening to something classy like jessica or ashlee"", ' ( Man speaking French through headset )', ' ( Mia smugly gives Greg a plug . )', ' ( He sticks it in his ear and hears a male voice speaking in French . )', "" [[Mia_Dickerson]] it 's ... jean-paul sartre"", "" [[Mia_Dickerson]] 'huis clos '"", "" [[Mia_Dickerson]] 'no exit ?"", "" [[Mia_Dickerson]] '"", ' [[Mia_Dickerson]] it loses something in a translation', ' [[Greg]] oui , oui', ' [[Mia_Dickerson]] the blood from the hairy wad that you found in the drain is consistent with the victim', "" [[Greg]] and what about the semen from martha 's sae ?"", "" [[Mia_Dickerson]] that 's consistent with the dna from the first attack"", ' [[Mia_Dickerson]] you are looking at the same rapist', ' [[Mia_Dickerson]] i want to show you something', ' [[Greg]] really ?', ' ( She points to the microscope . )', ' ( They exchange places and Greg looks through the scope . )', ' ( Sperm with red spots around it . )', "" [[Greg]] this guy 's immune system does n't recognize his own sperm"", ' [[Greg]] antibodies are attacking the little guys', ' [[Mia_Dickerson]] i read about this phenomenon in a forensic journal', ' [[Greg]] november , 2003', ' [[Greg]] killer had a vasectomy , then had it reversed', ' [[Mia_Dickerson]] oui , oui', ' [[Greg]] thanks , mia', ' ( Mia nods and smiles as Greg leaves . )']",1,Evidence
14,"["" ( Close-up of : Ty Hawkins ' bashed and beaten face is on the monitor . )"", ' ( Camera moves aside and we find Robbins going over the body with Catherine . )', ' [[Robbins]] how could a boy have made someone so mad ?', ' [[Robbins]] c-o-d is blunt-force trauma', ' [[Robbins]] i counted fourteen separate blows', ' [[Robbins]] several more were coinciding', ' [[Robbins]] cylindrical weapon , about an inch in diameter', ' [[Catherine]] consistent with a pipe ?', ' [[Robbins]] yeah', ' [[Robbins]] in fact , check this out', "" ( Quick CGI POV : Close-up of Ty Hawkins ' head and a particular bruising indentation in his left forehead that looks to be in the shape of the threads of the pipe . )"", ' ( The virtual image of a pipe is placed over the matching wound . )', "" [[Robbins]] thread pattern 's consistent with the end of a pipe"", ' ( The virtual pipe vanishes . )', ' ( End of CGI POV . )', ' ( Resume to present . )', "" ( Catherine picks up Ty Hawkins ' hand and looks at it . )"", "" [[Catherine]] he 's got no defense wounds"", ' [[Robbins]] yeah', ' [[Robbins]] my guess , he never woke up', ' ( Catherine looks at the beaten little boy and shakes her head . )']",0,None
15,"[' ( Nick sits across the table from Matthew Hawkins . )', ' ( Matthew puts his shoe on the table for Nick . )', ' ( Det Cavaliere starts in on Matthew . )', "" [[Det._Chris_Cavaliere]] you 're not fooling me , kid"", ' [[Det._Chris_Cavaliere]] the second i laid eyes on you , i knew how it went down', "" [[Det._Chris_Cavaliere]] you took a pipe from the backyard , you went into ty 's bedroom , and while he was sleeping , you beat his brains to a pulp"", ' ( Nick glances at Det Cavaliere . )', "" [[Det._Chris_Cavaliere]] now , what the hell 's wrong with you , kid ?"", ' [[Det._Chris_Cavaliere]] your little brother is dead', ' [[Det._Chris_Cavaliere]] what did he ever do to you ?', ' ( Matthew looks at Nick . )', "" ( Det Cavaliere gets in Matthew 's face . )"", "" [[Det._Chris_Cavaliere]] now , do n't look at him"", "" [[Det._Chris_Cavaliere]] he ca n't help you"", ' [[Det._Chris_Cavaliere]] nobody can help you', "" [[Det._Chris_Cavaliere]] you 're going to prison"", ' [[Det._Chris_Cavaliere]] and at fourteen , that means life', "" [[Det._Chris_Cavaliere]] i 'm talking to you , you little ... !"", ' ( Matthew jumps . )', ' ( Nick interrupts him . )', ' [[Nick]] detective ... can i have a word with you outside , please ?', ' ( Nick and Det Cavaliere leave the room . )']",0,None
16,"[' ( Nick closes the door behind them . )', "" [[Nick]] we do n't have enough evidence to suggest that that boy killed his brother"", ' [[Det._Chris_Cavaliere]] well , what are you getting at ?', "" [[Nick]] i 'm saying i 'm not sure if threatening him is the right tactic right now"", ' [[Nick]] i found no blood on his clothes', ' [[Nick]] the screen door could have been the point of entry', ' [[Nick]] i mean , have you considered asking him what he heard or-or saw before you just put the full court press on him ?', "" [[Det._Chris_Cavaliere]] i do n't tell you how to collect the evidence"", "" [[Nick]] no , you do n't"", "" [[Nick]] look , there 's no disrespect here , okay ?"", "" [[Nick]] we 're all on the same team"", ' [[Det._Chris_Cavaliere]] then get to the lab and get me something that i can use', ' ( Det Cavaliere turns and leaves . )', ' ( Nick sighs . )']",0,None
