scene_id,scene_text,in_summary,aspects
37,"[' ( Hodges removes a petri dish with the wad of hair out from under the microscope . )', ' ( Grissom walks into the lab . )', ' [[Grissom]] you called me ?', ' [[David_Hodges]] yeah , mia sent me that wad of hair that you pulled out of the hotel drain', ' ( He puts the wad of hair back in its container and turns to look at Grissom . )', "" [[David_Hodges]] it 's coated in bleach"", "" [[David_Hodges]] i 'm thinking the killer must 've poured the stuff down the drain really compromised the trace"", "" [[Grissom]] that 's it ?"", ' [[Grissom]] a compromised wad of hair ?', ' [[David_Hodges]] no , uh , i called you to discuss the bleach', ' [[David_Hodges]] the hairy wad smelled a bit woodsy to me', ' [[David_Hodges]] which is odd , considering it should only smell like bleach', ' [[Grissom]] you sniffed it ?', ' [[David_Hodges]] that disgust you ?', "" [[Grissom]] no , actually , it 's the first time you 've ever done anything to impress me"", ' [[David_Hodges]] hm', ' [[David_Hodges]] anyway , um , i analyzed the bleach', ' [[David_Hodges]] it contains a cedar additive', "" [[David_Hodges]] thought you 'd want to know"", ' ( Grissom takes the container with the wad of hair , turns and heads out of the lab . )', ' [[Grissom]] thanks , david', ' [[David_Hodges]] sure , gil']",1,Evidence
38,"[' ( A woman towing a luggage on wheels behind her walks down the hallway . )', "" ( Camera moves across the hallway and over to the General Manager 's office where Brass and Grissom interview Hayden Michaels . )"", ' ( The housekeeper , Lucy , is standing behind the desk near Hayden Michaels . )', "" [[Hayden_Michaels]] like i said , i 'm more than happy to help you in any way i can"", ' [[Hayden_Michaels]] so , when i got your phone call about the scent of our bleach , i figured you should to talk to lucy', ' [[Hayden_Michaels]] lucy is our head of housekeeping', ' [[Lucy]] the guests sometimes complained about the bleach smell after we cleaned the bathrooms a few years ago , i started adding cedar chips to the bottles', ' [[Lucy]] makes it smell better', ' [[Grissom]] lucy , who else has access to your bleach ?', ' [[Lucy]] just the maids', ' [[Brass]] are they all female ?', ' [[Lucy]] yes', ' [[Brass]] you park your carts in the hallway when you clean the room , so anyone could have swiped a bottle of bleach , right ?', "" ( Grissom looks around the General Manager 's desk and sees the family photos . )"", ' ( Camera passes over the first photo of Hayden Michaels with a dark-haired woman and an older son . )', ' ( The second photo behind it is of Hayden Michaels with a young , blonde-haired woman carrying a baby . )', ' [[Lucy]] no', "" [[Lucy]] we 've had problems with theft , towels mainly , but now our maids take their carts into the rooms"", ' [[Grissom]] those your kids ?', ' [[Hayden_Michaels]] yeah', ' [[Hayden_Michaels]] two eldest are at unlv', ' [[Grissom]] and the baby ?', ' [[Hayden_Michaels]] jake', ' [[Hayden_Michaels]] jake is , uh , six months old', ' [[Grissom]] is that your second wife ?', ' [[Hayden_Michaels]] mm-hmm', ' [[Grissom]] so you must have had your vasectomy reversed', ' ( Hayden Michael is a little startled by the sudden change in subject . )', ' [[Hayden_Michaels]] why are we talking about my vasectomy ?', "" [[Grissom]] you also have access to the bleach , so you wo n't mind if i take a dna sample"", ' [[Hayden_Michaels]] look', "" [[Hayden_Michaels]] if word leaks out that you took my dna and i 'm a murder suspect , i will never work in hospitality again i 'm sorry , the answer 's no"", ' [[Hayden_Michaels]] anything else ?', "" [[Brass]] we 'll be in touch""]",1,Evidence
39,"[' ( Catherine goes over the case and evidence with Nick and Warrick . )', "" [[Catherine]] so we 've got three suspects , three scenarios"", "" [[Nick]] yeah , matt could have worn his dad 's sweater when he killed ty"", ' [[Nick]] dumped it in the park during the night , where walter found it', ' [[Catherine]] or dad could have worn it and dumped it in the park', ' [[Warrick]] or this sweater could have accidentally been left in the park , and walter , the homeless guy , could have picked it up and worn it when he entered the house through the screen door and killed ty', ' [[Warrick]] but none of the evidence goes to motive', ' [[Catherine]] not our problem at the moment', "" [[Catherine]] let 's just stay focused on the sweater"", "" [[Catherine]] it 's tied to the victim and this scene"", ' [[Catherine]] we need to tie it to the killer', ' [[Catherine]] hey , how tall would you say matt hawkins ?', ' [[Nick]] about five feet , why ?', "" [[Nick]] dad is ... 6'2 '"", ' [[Nick]] what about walter ?', "" [[Warrick]] mmm ... 5'10 '"", "" [[Warrick]] about nick 's height"", ' ( Warrick and Nick nod . )', ' [[Nick]] yeah', ' [[Warrick]] what you getting at ?', ' [[Catherine]] meet me in the garage in half an hour', ' ( Catherine turns and leaves . )']",0,None
40,"["" ( CU : The blue sign for the 'Interview Room ' is lit . )"", ' ( Inside , Grissom interviews Hayden Michaels in the presence of his attorney , Adam Matthews . )', "" [[Grissom]] mr michaels , in my work over the last twenty-five years , i 've come to understand the kind of person who 's a rapist-killer"", ' [[Adam_Matthews]] is that an accusation ?', "" [[Grissom]] well , a woman was murdered in your client 's hotel"", ' [[Grissom]] he has a right to hear our theory', ' [[Grissom]] the killer is clearly a psychopath', "" [[Grissom]] he 's killed more than once"", "" [[Grissom]] i 'm sure that before his first rape and murder he fantasized about it for years"", ' ( Quick flash to : [_MOTEL_ROOM_-_NIGHT_] The woman struggles , trying to get away from the killer . )', ' [[Woman]] no', ' [[Woman]] no !', ' [[Woman]] woman : no !', ' [[Woman]] woman : get away !', ' ( She falls back on the bed . )', ' ( He covers her mouth with his hand and holds the knife to her face . )', ' [[Killer]] quiet !', ' [[Killer]] quiet !', ' [[Killer]] quiet !', ' ( He strips her . )', ' [[Woman]] no !', ' ( End of flashback . )', ' ( Resume to present . )', ' [[Grissom]] during that time , he engaged in behavioral tryouts', ' [[Grissom]] stalking women and attempting to coerce them sexually , each time moving closer and closer to the actual event', ' ( Quick flashback to : [_MOTEL_ROOM_-_NIGHT_] The killer has the woman on the bed . )', ' ( His hand is over her mouth . )', ' ( She cries . )', ' [[Killer]] shut up !', ' [[Killer]] shut up !', ' [[Killer]] killer : shhh- !', ' ( End of flashback . )', ' ( Resume to present . )', ' [[Grissom]] i believe that after you consummated your first attack , you felt excitement greater than you anticipated', ' [[Grissom]] your only regret was that she died too quickly', "" ( Quick flashback to : [_MOTEL_ROOM_-_NIGHT_] Hayden Michaels stands over Sue Stein 's dead body on the bed . )"", ' ( He holds the bloodied knife in his hand . )', ' ( End of flashback . )', ' ( Resume to present . )', ' [[Grissom]] but you took solace in the knowledge that , uh , you could do it again in fact , your subsequent victim had similar characteristics to your first victim', ' ( Quick flashback to : [_MOTEL_ROOM_-_NIGHT_] Hayden Michaels holds the knife on Martha Krell . )', ' [[Martha_Krell]] no !', ' [[Martha_Krell]] no !', ' [[Martha_Krell]] no !', ' [[Killer]] shut up !', ' [[Killer]] killer : shut up !', ' ( She cries as he strips her slowly . )', ' [[Martha_Krell]] please !', ' [[Martha_Krell]] please !', ' ( FAR SHOT : Hayden Michaels is on the bed with Martha Krell . )', ' ( She cries . )', ' ( Cut to : Martha Krell is dead . )', ' ( Hayden Michaels holds the knife as he looks around . )', ' ( End of flashback . )', ' ( Resume to present . )', ' [[Adam_Matthews]] this is a waste of time', "" [[Grissom]] you see , what differentiates a psychopath from a 'heat of the moment ' killer is forethought"", ' ( Quick flashback to : [_MOTEL_ROOM_-_NIGHT_] Hayden Michaels uses the bleach and cleans the room . )', ' ( He wipes down the tables . )', ' ( End of flashback . )', ' ( Resume to present . )', ' [[Grissom]] and you thought about this for a long time', ' [[Adam_Matthews]] thank you for the fascinating seminar , but you have no evidence , so we are free to go', ' ( The interview room door opens . )', ' ( Sara walks in with a wheelie luggage in tow behind her . )', ' [[Sara]] actually , i have some evidence', ' [[Hayden_Michaels]] what is this ?', "" [[Hayden_Michaels]] what 's going on ?"", ' ( Sara picks up the wheelie luggage and puts it on the table . )', ' ( She looks at Hayden Michaels expectantly . )', ' [[Sara]] mr michaels ?', ' ( Grissom looks at Hayden Michaels . )', "" [[Hayden_Michaels]] she ca n't ... you ca n't do that"", ' ( Adam Matthews looks at Hayden Michaels . )', ' [[Adam_Matthews]] do what ?', ' [[Hayden_Michaels]] no , i know my rights', ' [[Adam_Matthews]] hey , shh', ' [[Hayden_Michaels]] the bitch broke into my car', ' ( Sara and Grissom look at each other . )', "" [[Adam_Matthews]] i do n't remember seeing a warrant , ms sidle"", "" [[Sara]] i do n't have a warrant"", ' [[Sara]] i was following a hunch', ' ( Adam Matthews looks at Grissom smugly . )', ' [[Adam_Matthews]] well , then you just set my client free', ' [[Sara]] on the contrary', "" [[Sara]] western airlines issues this exact type of 'wheelie ' to all its flight attendants"", "" [[Sara]] since martha 's wheelie was n't in the hotel room , we thought maybe the killer took it ... as a souvenir"", ' [[Sara]] this particular suit case', ' ( Sara unzips the luggage to show them the tape recorder inside . )', "" [[Sara]] ... is not martha 's wheelie"", ' ( Adam Matthews smiles . )', "" [[Grissom]] and now that we know where to find it , and we have your client on tape , i bet you we 'll get a warrant"", ' ( Grissom turns to Hayden Michaels . )', ' [[Grissom]] thank you', ' ( Camera holds on Sara . )']",1,Motive
41,"[' ( Catherine is putting red dye on the head of a dummy . )', ' ( Warrick stands in front of the counter watching . )', "" ( He 's wearing goggles and a clean sweater . )"", ' [[Catherine]] okay , warrick , you are approximately the height of martin hawkins', "" [[Catherine]] nick , you and the homeless dude are about the same , and judy , you 're close to matt"", ' ( Nick and Judy are also wearing clean sweaters . )', "" [[Catherine]] the table is the same height as ty 's bed - forty-three and half inches from the floor to the top of the mattress"", ' [[Catherine]] the white sweaters , which you all look so adorable in , are the same fabric as the bloody one', ' ( Catherine walks around the counter and over to the shelf where the pipes are . )', "" [[Catherine]] the pipes are the same diameter as the wounds on ty 's face"", ' [[Catherine]] i want each of you to take a whack at our victim', ' ( She hands a pipe to each person . )', ' [[Judy_Tremont]] just like chuckie cheese', ' [[Judy_Tremont]] whack-a-mole', ' ( Catherine chuckles . )', ' [[Catherine]] uh , spatter up', ' ( Warrick steps up to the counter first . )', ' ( He uses both hands to grip the pipe and hits the dummy on the counter . )', ' ( With every whack , the red dye spatters on his white sweater . )', ' ( Quick VIRTUAL POV of : Martin Hawkins holds the pipe and whacks Ty Hawkins as he sleeps . )', ' ( Quick flash to : [_BEDROOM_-_NIGHT_] Martin Hawkins whacks Ty Hawkins as he sleeps . )', ' ( End of flash . )', ' ( Resume to present . )', ' ( Cut to : Nick whacks the dummy on the counter . )', ' ( With every one-handed whack , the red dye spatters on his white sweater . )', ' ( Quick VIRTUAL POV of : Walter holds the pipe and whacks Ty Hawkins as he sleeps . )', ' ( Quick flash to : [_BEDROOM_-_NIGHT_] Walter whacks Ty Hawkins as he sleeps . )', ' ( End of flash . )', ' ( Resume to present . )', ' ( Cut to : Judy Tremont whacks the dummy on the counter . )', ' ( With every two-handed whack , the red dye spatters on her white sweater . )', ' ( Quick VIRTUAL POV of : Matthew Hawkins holds the pipe and whacks Ty Hawkins as he sleeps . )', ' ( Quick flash to : [_BEDROOM_-_NIGHT_] Matthew Hawkins whacks Ty Hawkins as he sleeps . )', ' ( End of flash . )', ' ( Resume to present . )']",0,None
42,"["" ( Warrick 's white sweater has spatters on the top three-fourths of his sweater . )"", "" ( Catherine steps over to Nick 's sweater . )"", ' ( The spatters cover half of the sweater , up to his elbows . )', "" ( Catherine looks over at the blue sweater and sees that it 's not a match . )"", "" ( Catherine steps over to Judy Tremont 's sweater . )"", ' ( The spatters cover the top one-fourth of the sweater , up to her mid-chest . )', "" ( It 's a match to the original blue sweater . )"", ' ( Quick flashback to : [_BEDROOM_-_NIGHT_] Ty Hawkins is sleeping in bed . )', ' ( Matthew steps into the room and bashes his head in with a pipe . )', "" ( The blood spatters on the blue sweater he 's wearing . )"", ' ( Cut to : [_PARK_-_NIGHT_] Matthew removes the sweater and drops it on the park bench . )', ' ( End of flashback . )', ' ( Resume to present . )', "" ( Judy 's sweater matches the original blue sweater . )"", ' [[Catherine]] judy , your sweater -- killer']",1,Evidence
43,"[' ( Matthew talks with Nick and Det Cavaliere . )', ' [[Matthew_Hawkins]] like i told him , i did it', ' [[Matthew_Hawkins]] you want a medal for figuring out what i already said ?', ' ( On the other side of the observation mirror , his parents watch the interview . )', ' [[Det._Chris_Cavaliere]] you never told me why', "" [[Matthew_Hawkins]] why 's it matter , anyways ?"", ' ( Yvonne Hawkins turns and cries . )', ' ( Martin holds her . )', ' ( He looks at Warrick . )', ' ( Warrick motions with his head . )', ' [[Warrick]] go ahead', ' ( Martin leaves the room . )', ' ( Martin walks into the interview room . )', ' ( Matthew is clearly surprised to see him . )', ' [[Matthew_Hawkins]] dad', ' [[Martin_Hawkins]] i want to know why', ' [[Matthew_Hawkins]] dad', ' [[Martin_Hawkins]] why ?', ' [[Martin_Hawkins]] damn it', ' [[Martin_Hawkins]] ty looked up to you', ' [[Martin_Hawkins]] he ... he loved you', ' [[Matthew_Hawkins]] he told', ' [[Matthew_Hawkins]] he told everyone !', ' [[Martin_Hawkins]] that you wet the bed ?', ' ( Matthew stands up and screams )', ' [[Matthew_Hawkins]] shut up !', ' ( Martin stares at his son . )', ' ( Matthew sits back down in his chair and starts crying . )', ' [[Matthew_Hawkins]] dad', "" [[Matthew_Hawkins]] i 'm sorry"", ' [[Matthew_Hawkins]] i', ' ( Martin shakes his head . )', ' ( Yvonne Hawkins cries . )', ' ( Martin turns and looks back at the mirror where he knows Yvonne is . )', ' ( He shakes his head and looks at Matthew . )']",1,Motive
44,"["" ( Close-up : Matthew Hawkins ' hands are handcuffed behind his back . )"", "" ( He 's escorted down the hallway . )"", ' ( As he passes them , he tries to go to his mom , but the officers stop him . )', ' [[Yvonne_Hawkins]] oh , matthew', ' ( The officers lead Matthew away . )', ' ( Martin leads Yvonne away . )', ' ( Down the hall , Nick watches . )', ' ( From behind him , Det Cavaliere turns the corner . )', ' ( He sees Nick and heads over to him . )', ' [[Det._Chris_Cavaliere]] hey', ' [[Det._Chris_Cavaliere]] you owe me an apology', ' ( Det Cavaliere looks at him expectantly . )', ' ( Nick nods a little . )', "" [[Nick]] i 'm sorry"", ' ( Nick turns away . )', ' [[Nick]] ... that you feel that way', ' ( Nick turns and leaves . )']",0,None
