scene_id,scene_text,in_summary,aspects
27,"[' ( Warrick and Nick walk into the Video Arcade . )', ' [[Warrick]] the first victim was killed with a weapon of opportunity , the table saw', ' [[Warrick]] the second victim gets a crack on the head', "" [[Nick]] so you 're thinking the weapon is still in here ?"", ' [[Warrick]] yeah', ' [[Nick]] why would the killer leave it in here ?', ' [[Warrick]] well , the killer left the body here', "" [[Nick]] that 's true"", ' [[Nick]] mr pinscher had a cash-only business', "" [[Warrick]] and he did n't have a gun license"", ' ( Warrick heads around the cash register counter . )', ' ( Camera moves down to show the bat under the counter . )', ' ( Nick looks around the area . )', ' ( Warrick finds the bat . )', ' [[Nick]] you got something ?', ' [[Warrick]] yes', ' ( Warrick takes a digital photo of the bat . )', ' ( Camera zooms down the bat through the grooves in the wood . )', ' ( Resume regular view . )', ' ( Warrick removes the bag from his holding place under the counter . )', ' ( He shows it to Nick . )', ' [[Warrick]] a little store security']",1,Evidence
28,"[' ( The Police officer leads a handcuffed Mrs Basengi through the hallway . )', ' [[Mrs._Basengi]] liars , liars , all men are liars !', ' ( Marty Gleason steps out of the room and sees her being led away . )', ' ( He turns and sees Warrick and Nick . )', ' [[Marty_Gleason]] hey , did you -- ?', ' [[Warrick]] it seems that the missus caught her husband collecting rent from the late melissa poolie', ' [[Warrick]] she just waited till he left the building', ' ( Quick flashback to : [_VIDEO_ARCADE_] Mrs Basengi and Melissa Poolie argue . )', ' [[Mrs._Basengi]] you slut !', "" [[Mrs._Basengi]] i do n't care what he told you , you still have to pay rent"", ' [[Melissa_Poolie]] go to hell !', ' ( Melissa Poolie turns to leave . )', ' ( Mrs Basengi grabs the bag and hits her on the back of the head . )', ' ( Melissa Poolie falls to the floor . )', ' ( Mrs Basengi drops the bat and grabs the plastic sheeting . )', ' ( End of flashback . )', ' ( Resume to present . )', ' [[Warrick]] luckily , she left her prints behind', "" [[Warrick]] we had them on file from an assault case in '98"", ' [[Nick]] yeah , she went a little further this time', ' [[Marty_Gleason]] yeah , from what i hear , she did a lousy job cleaning that bat', ' [[Marty_Gleason]] amateur', ' [[Marty_Gleason]] you know , you guys , you could have waited till after she paid me to arrest her', ' [[Marty_Gleason]] what did i ever do to you ?', ' [[Marty_Gleason]] oh , except crack your case wide open', "" [[Nick]] do n't worry , man , grissom talked to the sheriff , said he 's gon na pick up your tab"", ' [[Marty_Gleason]] really ?', ' [[Nick]] mm-hmm', ' ( Marty chuckles . )', ' [[Marty_Gleason]] thanks', ' [[Marty_Gleason]] hey , you think this could mean a nice , fat city contract for me ?', ' ( Not wanting to touch that one , Warrick and Nick both leave . )', ' [[Warrick]] good to see you , marty', ' [[Nick]] see you around , marty', ' [[Marty_Gleason]] call me']",1,Motive
29,"["" ( Grissom opens the morgue cabinet with Vanessa Keaton 's body inside . )"", ' ( He pulls out the table so he and Sara can compare the body with the photos . )', ' ( Grissom lifts the sheet to look at her belly button . )', "" ( It does n't match with the photo . )"", ' [[Grissom]] innie', ' [[Grissom]] outie', ' ( Sara changes the photo to one with moles . )', "" [[Grissom]] ... and vanessa does n't have any moles on her torso"", ' [[Sara]] the woman in the photo is not vanessa', ' [[David_Phillips]] oh , you got my message', ' [[Sara]] what message ?', ' [[David_Phillips]] to meet me here', ' [[David_Phillips]] i was preparing a body for a mortuary pickup , and i noticed something', ' ( David lifts the body to show them the bruising on the back around the puncture wounds . )', ' [[David_Phillips]] postmortem bruising', ' [[Grissom]] well , it can take a day or two after autopsy for the bruises to percolate through the soft tissue and become visible', "" [[Sara]] vanessa was n't stabbed four times with a skewer"", ' [[Sara]] she was stabbed twice with a two-pronged instrument', ' ( Quick CGI POV : Someone screams A two-pronged instrument is stabbed into her back . )', ' ( End of CGI POV . )', ' ( Grissom looks at Sara . )']",1,Evidence
30,"["" ( Greg is back in the Cunningham 's backyard . )"", ' ( He looks around and finds the hanging bar-b-cue utensils . )', ' ( He puts his kit down and takes a picture of the fork . )', ' ( He tests it and finds blood . )']",1,Evidence
31,"[' ( Grissom walks into the lab where Sara is working on the laptop . )', "" [[Sara]] i just started combing through tom cunningham 's computer"", "" [[Sara]] i have n't i.d 'd our mystery woman , but there 's just lots of back and forth between cunningham 's e-mail account and keaton 's"", ' [[Grissom]] any attachments ?', ' [[Sara]] yeah', "" [[Sara]] got one for the keatons ' account"", "" [[Sara]] 'u axd 4 my pic so here"", "" [[Sara]] sweetkeat '"", ' ( She clicks on the picture and finds the photo . )', "" ( It 's the same photo . )"", ' ( Grissom shakes his head . )', ' ( Sara glances at him . )', ' [[Grissom]] any reply ?', ' [[Sara]] yes', ' [[Sara]] from ... cunning1', "" [[Sara]] 'can you handle it ?"", ' [[Sara]] midnight', "" [[Sara]] behind the skate park '""]",0,Evidence
32,"[' ( On the monitor is security tape footage from behind the skate park . )', ' ( It shows Tom Cunningham meeting with Amy Keaton . )', ' ( He opens the back of his SUV and climbs in She removes her top as she prepares to climb inside also . )', ' [[Tom_Cunningham]] you can stop the tape', ' ( Brass turns the tape off . )', ' [[Tom_Cunningham]] amy came on to me', "" [[Brass]] she 's fifteen"", ' [[Tom_Cunningham]] does she look fifteen to you ?', ' [[Adam_Matthew_(lawyer)]] tom , be very quiet', ' [[Tom_Cunningham]] they got me on tape', "" [[Tom_Cunningham]] i 'm trying to explain"", "" [[Brass]] she 's a minor , you 're an adult"", "" [[Brass]] what 's to explain ?"", "" [[Adam_Matthew_(lawyer)]] we have information pertaining to vanessa keaton 's death"", ' [[Adam_Matthew_(lawyer)]] get me the d.a', ' [[Adam_Matthew_(lawyer)]] we want a deal', ' ( Brass stares at them for a long moment . )', ' [[Brass]] too late']",1,"Evidence,Motive"
33,"[' ( Sara compares the photo with Amy Keaton . )', ' ( Sara and Grissom interview Amy Keaton with Dan Keaton in the room . )', ' [[Sara]] you are an inny', ' [[Sara]] amy , you e-mailed this photo of yourself to tom cunningham', "" [[Dan_Keaton]] what 's she talking about ?"", ' [[Amy_Keaton]] i have no idea', ' [[Sara]] you were having an affair with tom cunningham', "" [[Sara]] he 's just been booked on statutory rape"", ' [[Dan_Keaton]] what ?', "" [[Amy_Keaton]] it was n't rape"", ' ( Dan gets to his feet . )', "" [[Dan_Keaton]] i 'm gon na to kill that son of a bitch !"", ' [[Amy_Keaton]] like you care who i have s*x with ?', "" [[Amy_Keaton]] i know about your parties , all the kids know , so do n't get all righteous on me"", ' [[Amy_Keaton]] i want to see tom', "" ( Dan grabs Amy 's hand . )"", "" [[Dan_Keaton]] let 's go"", ' [[Grissom]] mr keaton , sit down , please', "" [[Grissom]] we 're not done yet"", ' ( Dan , Amy and Sara sit down . )', ' ( Grissom takes out the bar-be-cue fork in a plastic bag . )', ' ( He puts it on the table . )', "" [[Grissom]] we retrieved this from the cunningham 's backyard"", "" [[Grissom]] your stepmother 's blood is on the tines , and your fingerprints are on the handle"", ' ( Quick flashback to : [_NIGHT_] Tom Cunning and Vanessa Keaton are in the pool kissing when Amy Keaton walks into the back yard . )', ' ( She sees them together and grabs the fork . )', ' ( She stabs Vanessa in the back twice . )', ' [[Tom_Cunningham]] easy , easy', ' ( End of flashback . )', ' ( Resume to present . )', "" [[Sara]] the stab wounds were n't fatal , but your stepmother was knocked unconscious"", ' [[Sara]] it took two or three minutes for her to drown', "" [[Grissom]] that 's a long time to stand around and watch someone die"", "" [[Amy_Keaton]] it was n't like that"", ' ( Quick flashback to : [_NIGHT_] After stabbing her , Amy shouts at Tom as he holds her wrists trying to calm her down . )', ' [[Amy_Keaton]] how could you !', ' [[Tom_Cunningham]] calm down !', ' ( They both turn to look at Vanessa in the pool . )', ' [[Tom_Cunningham]] you need to go home , right now', ' [[Amy_Keaton]] oh , my god', ' [[Amy_Keaton]] oh , my god', ' ( Amy turns and leaves . )', ' ( End of flashback . )', ' ( Resume to present . )', ' [[Amy_Keaton]] he was trying to protect me', ' [[Amy_Keaton]] so we put her in the fountain', ' ( Grissom looks from Dan to Amy . )', ' [[Amy_Keaton]] he loves me', ' [[Amy_Keaton]] can i see him ?']",1,Motive
34,"[' ( Sara and Grissom step out of the interview room . )', ' ( Together , they walk down the hallway side-by-side . )', "" ( For a moment , they 're silent . )"", ' [[Sara]] arrive as a couple , leave as a couple', ' [[Grissom]] no photos , no video', ' [[Sara]] no affairs', ' [[Grissom]] and the kids must never know']",0,None
