scene_id,scene_text,in_summary,aspects
13,"[' ( Greg takes a sample of the pool water . )', ' ( He takes the sample as Grissom logs it on the clipboard . )', ' ( Brass is interviewing Erin Brady , the party hostess . )', "" [[Erin_Brady]] no one 's allowed to treat their pools with chlorine"", "" [[Erin_Brady]] it 's in the homeowners ' regulations"", ' ( Paul Brady walks outside and joins them . )', ' [[Paul_Brady]] what the hell is going on ?', ' [[Erin_Brady]] they have a warrant', ' [[Paul_Brady]] a warrant for what ?', ' [[Grissom]] when was the last time you had your pool cleaned ?', ' [[Paul_Brady]] guy was here this morning', ' [[Paul_Brady]] why ?', "" [[Brass]] we 're asking the questions , mr brady"", "" [[Erin_Brady]] look , look ... we 're all in shock"", ' [[Erin_Brady]] vanessa was one of those people who was so alive , so much fun', ' [[Brass]] so , tell me about last night', ' [[Brass]] was it a special occasion ?', ' [[Erin_Brady]] we just had the neighbors in for cocktails', ' [[Paul_Brady]] we do it once a month', ' [[Paul_Brady]] we , uh ... we all take turns', ' [[Grissom]] was mrs keaton wearing this dress last night ?', ' ( Grissom shows them a picture of the dress . )', ' ( Erin Brady looks at it and nods . )', ' [[Erin_Brady]] yes', ' [[Erin_Brady]] i noticed -- i have the same one in pink', ' [[Brass]] you notice anything else , anything out of the ordinary ?', ' [[Brass]] like an argument or a fight ?', ' [[Paul_Brady]] no , no , no', ' [[Paul_Brady]] we are a friendly group', ' [[Grissom]] did she leave alone ?', ' [[Erin_Brady]] her husband left about an hour earlier', ' [[Brass]] he seem upset when he left ?', ' [[Erin_Brady]] not that i noticed', "" [[Erin_Brady]] vanessa 's death was an accident , right ?"", ' ( Greg finishes putting the label on the sample jar . )', ' ( He stands up . )', ' [[Greg]] got it', ' [[Grissom]] may we take a look inside your house ?', ' ( She steps aside . )', ' [[Erin_Brady]] look wherever you want', ' ( Grissom walks by her between her and her husband . )', ' ( He glances at Brass who smiles at him . )', ' ( Grissom heads into the house . )', ' ( Grissom puts on his latex gloves and looks around the clean living room . )', "" [[Grissom]] well , by the way you 've cleaned up , mrs brady , i would n't even know you had a party in here last night"", ' ( Erin and Paul stand inside the living room . )', ' [[Erin_Brady]] thank you', ' [[Grissom]] what kind of party was it ?', ' [[Erin_Brady]] a mixer', ' ( Grissom and Greg look at each other . )', ' ( Grissom heads into the kitchen while Greg lingers in the living room . )', ' ( Grissom looks around the kitchen . )', ' ( He opens the case on the counter and finds two of the four skewers in the case . )', ' ( He takes one out . )', ' [[Grissom]] mrs brady , would you join me in here , please ?', ' ( Erin Brady walks into the kitchen . )', ' [[Grissom]] where are your other skewers ?', "" [[Erin_Brady]] i do n't know"", ' ( The dishwasher finishes . )', ' ( Grissom walks over to it and opens it . )', ' ( He pulls out the top rack in the dishwasher and picks up a light-colored dildo . )', ' [[Grissom]] well , cleanliness is next to godliness', ' ( Erin shrugs . )', "" ( Paul looks back at Greg who ca n't help but chuckle . )""]",0,None
14,"[' ( Marty Gleason carries out two red plastic bags from the arcade as Nick and Warrick sit on the sidewalk curb eating their lunches.. )', ' [[Marty_Gleason]] after overhead and costs , fifty cents a pound for waste disposal , i clear about three to five bills a job', ' ( Marty puts the two bags in the back of his van . )', ' [[Warrick]] how many cases do you get a week ?', ' [[Marty_Gleason]] how many cases do you do a week ?', ' [[Warrick]] rate gets us ten to twenty', ' [[Marty_Gleason]] ditto', ' [[Nick]] you trying to tell me you make between three and ten grand a week ?', "" [[Marty_Gleason]] you 've got to be authorized to clean up biologicals"", "" [[Marty_Gleason]] if some high school wage slave mops up a nose bleed at mickey d 's , they 're breaking the law"", "" [[Marty_Gleason]] i 've got three employees making thirty bucks an hour"", ' [[Marty_Gleason]] if you guys are interested in earning a little extra on the side ?', ' [[Warrick]] working for you , no thanks', ' [[Marty_Gleason]] crime rate is on the rise , my friends', "" [[Marty_Gleason]] you 'd be wise to get in on the ground floor"", ' [[Marty_Gleason]] i am thinking about starting a franchise in arizona', ' [[Marty_Gleason]] retirees die messy', ' [[Marty_Gleason]] like , bodies been on the floor for a while', ' [[Marty_Gleason]] sometimes you got to replace the entire floor', ' [[Marty_Gleason]] oh , look , i install floors , and drywall', ' ( He hands each of them his card . )', ' ( A car horn beeps . )', "" [[Marty_Gleason]] ceilings , too , and homeowner 's insurance picks up the tab"", ' ( A black SUV pulls up . )', ' ( Marty walks over to Mrs Basengi . )', "" [[Mrs._Basengi]] what 's going on , marty ?"", "" [[Mrs._Basengi]] you 're still here ?"", ' [[Mrs._Basengi]] you promised the place would be clean', ' [[Mrs._Basengi]] i found a contractor to finish the work', "" [[Marty_Gleason]] it 's out of my hands , ma'am"", "" [[Marty_Gleason]] the lab boys , they have n't quite released the scene yet"", ' ( He indicates Warrick and Nick behind him . )', ' ( Warrick and Nick look at each other and shake their heads . )', "" [[Marty_Gleason]] they 're moving at the speed of government"", ' [[Marty_Gleason]] how are you doing with the funeral arrangements ?', ' [[Mrs._Basengi]] your cousin is taking very good care of me , thank you', ' [[Marty_Gleason]] we are here for you', "" [[Marty_Gleason]] now , i tell you what , i 'm going to call you as soon as i 'm done , okay ?"", ' [[Mrs._Basengi]] okay', "" [[Marty_Gleason]] thank you , ma'am"", ' ( Mrs Basengi drives away . )', ' [[Nick]] you should be ashamed of yourself , marty', ' [[Marty_Gleason]] oh , no', ' [[Marty_Gleason]] the bereaved often find a southern accent very comforting', ' ( Marty heads back into the arcade . )']",0,None
15,"[' ( Marty Gleason , Nick and Warrick walk back into the arcade . )', ' [[Marty_Gleason]] comfort is what i give these people , living victims the kind you guys never deal with', ' [[Marty_Gleason]] i see people on the worst day of their lives', ' [[Marty_Gleason]] in a small way , i make their world normal again', ' ( Marty heads into the back of the arcade to pick up the large tub . )', ' ( Warrick and Nick notice the smell immediately . )', "" ( They look around and find that it 's coming from one of the plastic-covered machines . )"", ' ( Nick pulls the plastic off of the video machine and the smell immediately hits them . )', ' [[Warrick/Nick]] oh !', ' [[Warrick]] well , it smells like eternity for somebody in here', ' ( Nick puts on his gloves . )', ' [[Nick]] the plastic must have covered the smell', ' ( Warrick opens the coin slot and the smell is more pronounced . )', ' [[Warrick]] oh !', ' ( Nick gasps and starts breathing out of his mouth . )', "" ( Cut to : Nick and Warrick remove the screws holding the video machine 's back panel in place . )"", ' ( Marty Gleason looks over their shoulders as Warrick removes the panel . )', "" ( Inside the machine on the bottom is a dead woman 's body wrapped in plastic . )"", ' [[Marty_Gleason]] holy mackerel', ' [[Marty_Gleason]] bitch in a box', ' [[Nick]] hey , hey , hey', "" [[Marty_Gleason]] i 'm sorry"", "" [[Marty_Gleason]] i 'm sorry"", ' [[Marty_Gleason]] i get paid by the body', ' ( Warrick coughs from the smell . )']",1,"Crime scene,Victim"
16,"[' ( Mia Dickerson goes through the things Greg brought back from the house . )', ' [[Mia_Dickerson]] nine vibrators , five plugs , four strands of beads', ' [[Greg]] and a partridge in a pear tree', ' [[Greg]] some kids are happy playing in the sand box , others want every toy in the store', ' [[Greg]] and apparently these are dishwasher safe', "" [[Mia_Dickerson]] i 'll swab the nooks and crannies for semen , vaginal secretions and epithelials , but do n't get your hopes up"", "" [[Greg]] oh , my money 's on bag number two"", ' [[Mia_Dickerson]] twenty-six used condoms', ' [[Greg]] just like being back in college , right ?', "" [[Mia_Dickerson]] sara said you did n't lose your virginity until you were 22"", "" ( The smile freezes on Greg 's face . )"", ' ( He changes the subject . )', ' [[Greg]] grissom and i figured that they practiced safe s*x , so we processed their trash', ' [[Greg]] check them inside and out , please', "" [[Mia_Dickerson]] i 've analyzed condoms before , greg"", ' [[Mia_Dickerson]] just not in bulk', ' ( Mia reaches into the third package and takes out another plastic bag . )', ' [[Mia_Dickerson]] skewers ?', ' [[Greg]] yeah , screen them for blood', ' [[Greg]] possible weapon', ' ( Greg leaves the lab . )']",0,None
17,"[' ( David Phillips cuts through the plastic wrapped around the body . )', "" ( He 's assisted by Nick , Warrick and a Coroner . )"", ' ( Nick snaps a photo of the body as they work . )', ' ( Cut to : Warrick hands the boots to David . )', ' ( Nick takes more pictures . )', ' ( Cut to : David continues to cut through the plastic . )', "" ( Nick snaps more photos as they peel away the plastic from the dead woman 's body . )"", "" ( Cut to : Robbins takes a swab from the woman 's ear . )"", "" ( He takes a swab from the woman 's mouth and another from the woman 's nose . )""]",0,None
18,"[' ( Nick puts a photo of the dead woman on the table . )', "" [[Nick]] dental records id 'd the body found in the arcade machine"", ' ( Nick and Det Cavaliere are interviewing Charles Pinscher . )', ' [[Nick]] your ex-girlfriend melissa poolie', ' ( Nick puts more pictures down on the table . )', "" [[Det._Cavaliere]] she did n't leave town after all"", ' [[Det._Cavaliere]] you want to revise your story ?', ' ( Nick throws another photo on the table . )', ' [[Nick]] we also found semen in her vaginal cavity', ' [[Nick]] it matches your dead landlord', "" [[Det._Cavaliere]] your girlfriend was paying rent on her back and you did n't like it"", ' ( Quick flashback to : Charles Pinscher is yelling at Melissa Poolie . )', ' [[Charles_Pinscher]] you had s*x with our landlord ?', ' [[Melissa_Poolie]] at least i got off my ass and did something about it', ' ( He pushes her and she falls to the floor . )', ' ( He turns and grabs the plastic covering off of a nearby arcade machine . )', ' ( End of flashback . )', ' ( Resume to present . )', "" [[Charles_Pinscher]] that did n't happen"", ' [[Charles_Pinscher]] she told me she convinced basengi to give us more time on the rent', "" [[Charles_Pinscher]] i-i did n't know she was banging the guy"", "" [[Det._Cavaliere]] we do n't care why you killed her"", "" [[Charles_Pinscher]] i did n't kill her !"", "" [[Det._Cavaliere]] basengi evicts you , keeps your stuff and now you 've got a big problem"", ' [[Nick]] yeah , the dead body someone crammed into ms pac-man', ' ( Quick flashback to : Basengi is using the saw . )', ' [[Charles_Pinscher]] you can keep the rest of it !', ' [[Charles_Pinscher]] all i want is ms pac-man !', ' [[Mr._Basengi]] get the hell out of here', ' ( Basengi continues using the saw . )', ' ( Charles Pinscher grabs Basengi and slams him down on the saw . )', ' ( Basengi screams Blood spatters on the wall . )', ' ( End of flashback . )', ' ( Resume to present . )', ' ( Charles Pinscher looks at Nick . )', ' ( Nick takes the seat next to Charles Pinscher . )', ' [[Nick]] mr pincher , when someone is killed with a table saw , blood gets everywhere -- your hair and your clothes', ' [[Nick]] you would have had to take a long , hot shower , wash your clothes , clip your nails , toss your shoes', ' [[Nick]] are you sure you got it all , charlie ?', ' [[Nick]] hmm ?', "" ( Nick looks down at Charlie 's watch . )"", ' ( Suddenly , Charlie appears increasingly nervous . )', "" [[Nick]] that 's a nice watch"", "" [[Charles_Pinscher]] it was my dad 's"", ' [[Nick]] i was admiring the band', ' [[Nick]] lots of open spaces and nonporous surfaces', "" [[Nick]] that 's a perfect place for blood to hide , do n't you think , chris ?"", ' [[Det._Cavaliere]] yeah', "" [[Nick]] there 's a chemical i use called phenylthaline"", ' [[Nick]] it can detect a speck of blood the size of a pinprick', ' ( Camera zooms in and focuses on the watch band where it stops on some blood caught in the band . )', "" [[Nick]] i bet if i take that watch it 's going to tell me more than time , is n't it ?"", ' [[Det._Cavaliere]] you mind baby-sitting him while i get a warrant ?', ' ( Det Cavaliere stands up . )', ' [[Charles_Pinscher]] i just went to the arcade to scare him', ' [[Charles_Pinscher]] things got out of hand', ' [[Nick]] did you kill him ?', ' [[Charles_Pinscher]] it was an accident', ' [[Charles_Pinscher]] you guys have got to believe me , i did not kill melissa', "" [[Charles_Pinscher]] i did n't even know she was dead"", ' ( He starts crying . )']",1,None
19,"[' ( Catherine follows Grissom into his office . )', "" ( He 's holding an open book in his hand , reading through it as he heads for his desk . )"", "" [[Catherine]] i know that you got the memo , i 'm not sure that you read it"", ' [[Catherine]] eckley is being promoted to assistant director', ' [[Catherine]] they are taking applications for his supervisor spot on days', ' [[Catherine]] i want it', "" ( Grissom sits down and does n't say anything . )"", ' [[Catherine]] what ?', ' [[Catherine]] you want the day spot for yourself ?', "" [[Catherine]] you 're worried about giving me a good a.p"", ' [[Catherine]] score and breaking up the team ?', "" [[Catherine]] or maybe you just think that i 'm incapable of the position ?"", ' [[Catherine]] not worthy of the promotion ?', ' [[Catherine]] is that it ?', ' ( She rolls her eyes and scoffs . )', "" [[Catherine]] i 'm just always , always , always defending myself to you"", ' ( Catherine sits down . )', "" ( Grissom still has n't said anything . )"", "" [[Catherine]] i 'm unbelievable"", ' [[Catherine]] i have a daughter who is so starved for my attention , she is thumbing rides to fremont street to see her grandfather', ' [[Catherine]] the last person i want her around', "" [[Catherine]] i mean , not that it 's much better with my mother , who sees lindsay much more often than i do"", "" [[Catherine]] i am missing out on my daughter 's life"", ' [[Catherine]] i have no life of my own', ' [[Catherine]] would you just stop me and say something here ?', ' ( Grissom takes off his glasses and looks at Catherine . )', "" [[Grissom]] you want the job because you 're worried about lindsay ?"", "" [[Catherine]] that 's part of it , but"", ' [[Grissom]] the position calls for leadership , catherine', ' [[Grissom]] you have to inspire others , solve problems , which means you have to leave your own problems at home', ' [[Catherine]] i want the job because i can do it', "" [[Catherine]] i 'm qualified , i 'm motivated and i 'm ready , gil"", ' [[Catherine]] you know that i am', ' [[Grissom]] i do', ' [[Grissom]] which is why i already sent in your a.p', ' [[Grissom]] i gave you 100 %', ' [[Grissom]] i even put in a good word with the director', ' [[Grissom]] the rest is up to you', ' [[Grissom]] and', ' [[Grissom]] i hope you get it', ' ( Grissom puts his glasses back on . )', "" ( Catherine 's touched . )"", ' [[Catherine]] thank you', ' ( Catherine stands up and walks out of the office . )', ' ( Grissom sighs as he watches her go . )']",0,None
20,"[' ( Mia Dickerson has the condoms each in their own dish . )', "" ( She 's taking swabs from both the inside and outside of the condoms )""]",0,None
21,"[' ( Mia reports her results to Greg and Grissom . )', "" [[Mia_Dickerson]] i could n't get anything from the items in the dishwasher , including the skewers"", ' [[Mia_Dickerson]] no results', ' [[Mia_Dickerson]] however , the condoms produced', ' [[Mia_Dickerson]] i extracted dna from the semen', ' [[Mia_Dickerson]] results indicate ten males', ' ( Mia stands in front of the whiteboard that has her results listed on it . )', ' [[Mia_Dickerson]] the lubricant , which seemed to be popular , was good at retaining both epithelials and vaginal secretions', ' [[Mia_Dickerson]] 11 females , no codis hits', ' [[Grissom]] is our victim represented ?', ' [[Mia_Dickerson]] yes', ' [[Mia_Dickerson]] f-7', ' [[Mia_Dickerson]] we can match her with the semen from four different males', ' [[Greg]] m-4 , m-5 , m-1 , m-8', ' [[Greg]] she was the belle of the ball']",0,None
22,"[' ( Brass and Grissom interview Erin Brady . )', ' [[Erin_Brady]] my husband and i have a very strong marriage', ' [[Erin_Brady]] but yes , we enjoy the lifestyle', ' [[Brass]] the lifestyle ?', ' [[Erin_Brady]] we play', ' [[Brass]] no kidding', ' ( She turns and looks at Grissom . )', ' [[Erin_Brady]] swing', ' [[Grissom]] wife swapping', ' [[Erin_Brady]] paul and i had a rough patch a few years ago', ' [[Erin_Brady]] we almost called it quits', ' [[Erin_Brady]] swinging saved our marriage', ' [[Erin_Brady]] it was being with other people that made me realize just how much i love my husband', ' ( Sara interviews Paul Brady . )', ' [[Paul_Brady]] erin is the greatest wife in the world', ' [[Sara]] but you still had s*x with vanessa keaton ?', ' [[Paul_Brady]] yeah', ' [[Paul_Brady]] yeah', "" [[Paul_Brady]] it 's fun"", ' ( Quick flashback to : [_PARTY_] Paul Brady meets with Vanessa Keaton at the party and they both run up the stairs hand-in-hand to the bedrooms )', ' ( End of flashback . )', ' [[Brass]] how do you feel about vanessa keaton ?', ' [[Erin_Brady]] very attractive woman', ' [[Erin_Brady]] she was the reason we invited the keatons to the parties', ' [[Erin_Brady]] she was into it', "" [[Erin_Brady]] dan really was n't"", ' [[Sara]] how did your wife feel about you and vanessa keaton ?', "" [[Paul_Brady]] well , it 's not like we were having an affair"", "" [[Paul_Brady]] that 'd be breaking the rules"", ' ( Sara perks up . )', ' [[Sara]] the rules ?', ' ( Sara starts taking notes . )', ' [[Paul_Brady]] no , means no', ' [[Paul_Brady]] arrive as a couple , leave as a couple', ' [[Paul_Brady]] drugs , never', ' [[Paul_Brady]] condoms , condoms always', ' [[Erin_Brady]] no affairs', ' [[Erin_Brady]] s*x with someone other than your spouse is only allowed at the parties', ' [[Erin_Brady]] no photos , no video', ' [[Erin_Brady]] and the kids must never know', ' [[Paul_Brady]] i came home one night', ' [[Paul_Brady]] i parked the car in the driveway and went to the fridge to grab a beer', ' [[Paul_Brady]] it was the wrong beer', ' [[Paul_Brady]] i was in the wrong house', ' [[Paul_Brady]] anyway , it just got all the neighbors talking', ' [[Paul_Brady]] variety is a good thing', "" [[Paul_Brady]] and if you get the right group of people together , a couple of drinks , you 'd be surprised what can happen"", ' [[Erin_Brady]] everybody fantasizes about other people', ' [[Erin_Brady]] even you , mr grissom', ' [[Erin_Brady]] a neighbor , a friend ... girl at the office', ' ( The door opens . )', ' ( Paul Brady walks out of the hallway . )', ' ( Erin Brady walks out into the hallway . )', ' ( Sara is sitting in the hallway chair watching them . )', ' ( She watches as they meet and kiss . )', ' ( Grissom walks up to Sara and takes the seat next to her . )', "" ( He 's holding two cups . )"", ' ( He hands her a cup of tea . )', ' [[Sara]] thank you', "" [[Sara]] i know i 'm supposed to be objective ... but i think i have a problem with the lifestyle"", "" [[Grissom]] well , they 're consenting adults , it 's not illegal"", ' [[Grissom]] at most , they only hurt themselves', ' [[Sara]] tell that to vanessa keaton', ' [[Sara]] everyone has a jealousy gene', ' [[Grissom]] you think it was a crime of passion ?', ' [[Sara]] yeah', "" [[Sara]] when you have to go outside a marriage for passion , you 're in trouble"", "" [[Sara]] and you 're asking for trouble"", "" ( He looks over at the Brady 's . )"", "" [[Grissom]] well , they say they 're happily married"", "" [[Sara]] you think they 're happy ?"", "" ( Grissom does n't answer as he considers the question . )"", "" ( He does n't get to answer as his phone rings . )"", ' ( He answers the phone . )', ' [[Grissom]] grissom', ' [[Grissom]] very good , thanks', ' ( Grissom hangs up . )', "" [[Grissom]] hodges matched the water in vanessa keaton 's lungs"", ' [[Grissom]] he knows where she drowned']",0,Evidence
23,"[' ( Brass and Grissom interview Tom and Meg Cunningham . )', ' [[Brass]] so mr and mrs cunningham , was vanessa keaton here the night she died ?', ' [[Tom_Cunningham]] no', ' [[Grissom]] well , we matched the water in her lungs to your spa', ' [[Grissom]] and i see what appears to be a blood smear on the stone', ' [[Meg_Cunningham]] well , sometimes we forget to lock the gate', ' [[Brass]] so your neighbors come in and use the spa ?', "" [[Meg_Cunningham]] it 's possible"", ' [[Brass]] yeah , i guess so , i mean , you share everything else', ' [[Brass]] why not ?', ' [[Brass]] so what time did you leave the party ?', ' [[Tom_Cunningham]] around 11:30', "" [[Meg_Cunningham]] but we did n't come right home"", "" [[Brass]] where 'd you go ?"", ' [[Meg_Cunningham]] we went to the bellagio', ' [[Meg_Cunningham]] a nice , romantic night out , just the two of us', ' [[Tom_Cunningham]] sometimes being with others gives you the urge to be alone', "" ( Tom puts a hand casually on Meg 's shoulder . )"", ' ( She instinctively stiffens and glances at the hand before relaxing . )', ' ( Grissom notes the movement . )', ' [[Brass]] i see', "" [[Grissom]] well , we 're going to compel a dna sample , so we 'll know if you were intimate with vanessa keaton"", ' [[Tom_Cunningham]] i admit i had s*x with her and ... karen brady , and mallory stone', "" [[Brass]] three strikes you 're out"", ' ( Tom Cunningham smiles at Brass . )']",0,None
24,"["" ( Robbins is in the autopsy room with the Melissa Poolie 's body when Warrick walks in putting on a pair of gloves . )"", "" [[Robbins]] heard your suspect 's looking pretty good"", ' [[Warrick]] you heard right', ' [[Warrick]] charlie confessed to killing the landlord', "" [[Warrick]] and the blood on his watch is a match to bassngi 's dna"", ' [[Robbins]] what about her ?', ' [[Warrick]] swears he has nothing to do with it', ' [[Warrick]] you got a c.o.d', ' [[Robbins]] blunt-force trauma to the occipital region', ' [[Robbins]] no trace in the wound track', ' [[Warrick]] do you have any idea what hit her ?', ' [[Robbins]] yeah', "" [[Robbins]] the impact 's deep"", ' [[Robbins]] weapon was probably heavy', ' [[Robbins]] radius of curvature , roughly three centimeters', ' [[Robbins]] could be a pipe', ' [[Warrick]] could be anything']",1,Death cause
25,"["" ( Brass interview 's Meg Cunningham . )"", ' [[Brass]] mrs cunningham , you told us that you spent last night at the bellagio with your husband', "" [[Meg_Cunningham]] that 's correct"", ' [[Brass]] are you sure about that ?', ' [[Meg_Cunningham]] d-do i need a lawyer ?', "" [[Brass]] i mean , that 's your call , that 's your right , but let me point out that if you 're covering for your husband , that 's conspiracy after the fact"", ' [[Brass]] now , are you prepared to go to jail over this ?', ' ( She chuckles . )', ' [[Meg_Cunningham]] look , i-i answered your question', "" [[Brass]] okay , what if i told you the hotel maid told us that you were n't with tom , what would you say ?"", "" [[Meg_Cunningham]] i 'd say she was lying"", "" [[Brass]] you know , i 'm trying to help you out here , and i want to help you out , okay ?"", ' [[Brass]] but you got to cut the crap', ' [[Brass]] okay ?', ' [[Brass]] come on , tell me what happened', ' [[Brass]] i mean , security confirmed that you were with a female', ' [[Brass]] late 20s , blonde , i mean , she even paid for breakfast with her credit card', ' [[Brass]] so', "" [[Brass]] i 'll tell you what , why do n't we start over , okay ?"", ' [[Brass]] and you tell me what happened', ' [[Meg_Cunningham]] look , tom asked me to think about our son', ' [[Meg_Cunningham]] he begged me to say we were together', "" [[Meg_Cunningham]] i swear , i do n't know ... anything that went on between him and vanessa"", "" [[Meg_Cunningham]] i do n't know""]",0,None
26,"[' ( Grissom and Sara walk into the house . )', ' ( In one of the rooms , a boy is playing video games in front of the television set . )', ' ( Grissom and Sara continue through the house . )', ' ( Sara heads upstairs as Grissom heads into one of the rooms )', ' ( Sara walks into the home office and looks around . )', ' ( She looks at the shelf contents , then opens the desk drawer . )', "" ( She finds under the 'Vegas Life ' , she finds 'Big Bodacious Babes ' . )"", ' ( Grissom walks into the study . )', ' [[Sara]] found some p0rn', ' ( She stands and hands them over to Grissom who leafs through them . )', ' [[Grissom]] well , nothing new about this stuff', ' [[Grissom]] the frescos at pompeii were more explicit', ' [[Grissom]] the kama sutra and decameron', "" [[Sara]] yeah , but that 's art ; this ... is not art"", "" ( Sara holds up the issue of 'Bondage ' . )"", ' [[Grissom]] hmm', ' ( Grissom again opens the magazine and finds something recognizable . )', ' [[Grissom]] here we go', ' [[Grissom]] webcam photo', "" [[Grissom]] and she 's wearing la perla"", "" ( Grissom shows Sara the photo of the 'headless ' woman wearing black underwear . )"", ' [[Sara]] vanessa keaton']",1,Evidence
