scene_id,scene_text,in_summary,aspects
26,"[' ( Catherine watches as Grissom and Det Vartann question Adam Novak with his lawyer . )', ' [[Grissom]] mr novak , would you stick out your tongue , please ?', ' [[Lawyer]] what is this about ?', "" [[Grissom]] well , right now , it 's about his tongue"", ' [[Det._Vartann]] and two dead women', "" [[Det._Vartann]] we believe the second victim , holly pearson , bit her attacker 's tongue"", ' [[Grissom]] open up , please', ' ( Adam Novak sticks out his tongue for Grissom to look at . )', ' ( Grissom shines his flashlight on it . )', "" ( Thinking Grissom 's done , Adam turns away . )"", ' ( But Grissom stops him . )', ' [[Grissom]] uh-uh', ' [[Grissom]] once more', ' ( Adam Novak sticks out his tongue and Grissom snaps a photo of the teeth marks on it . )', ' [[Grissom]] thank you', "" [[Grissom]] that 's all i need"", ' ( Grissom leaves the room . )', ' [[Det._Vartann]] have a seat', ' ( Adam and his attorney sit down . )', ' [[Det._Vartann]] you comfortable ?', "" [[Det._Vartann]] we 're going to be a while"", ' [[Adam_Novak]] i know how this looks', ' [[Lawyer]] adam , i', ' [[Adam_Novak]] i advise some of the stupidest guys that come through this room', "" [[Adam_Novak]] and it 's my job is to keep their mouths shut"", "" [[Adam_Novak]] and i know what you 're thinking -- that i killed alice granger"", ' ( Quick flashback to : [_NIGHT_] Adam Novak chases Alice Granger . )', ' ( She trips and falls to her knees . )', ' ( He shoots her in the head . )', ' ( End of flashback . )', ' ( Resume to present . )', "" [[Det._Vartann]] you 're a mind reader"", ' [[Adam_Novak]] i already admitted that i picked her up at a bar the other night', "" [[Adam_Novak]] what i did n't mention , and you did n't ask was that i gave her a ride home"", ' ( Quick flashback to : [_CAR_-_NIGHT_] Adam Novak and Alice Granger are in his car . )', ' ( They lean toward each other ... )', ' [[Adam_Novak]] it got hot and heavy', ' [[Adam_Novak]] we both got what we needed', ' ( End of flashback . )', ' ( Resume to present . )', ' [[Adam_Novak]] then she said good night and got out of the car', ' [[Adam_Novak]] i drove off', "" [[Lawyer]] uh , do you have any evidence at all that refutes my client 's account , or suggests otherwise ?"", "" [[Det._Vartann]] our evidence pertains to the second victim , killed last night with the same gun , and we believe that a portion of your client 's tongue was in her stomach"", ' [[Adam_Novak]] i can explain that', ' [[Det._Vartann]] oh ?', ' [[Det._Vartann]] really', ' [[Adam_Novak]] her taxi never showed up', ' ( Quick flashback to : [_EXT_._)', ' ( HIGHBALL - NIGHT ] Holly Pearson waits outside for her taxi . )', ' ( Adam Novak comes out of the Highball and walks over to her . )', ' [[Adam_Novak]] i was drunk', ' [[Adam_Novak]] out of line', ' [[Adam_Novak]] bad couple of days , thanks to you guys', ' ( He and Holly start walking . )', ' [[Adam_Novak]] i was looking for a little release and i chose the wrong girl', ' ( He grabs her and starts kissing her . )', ' ( She struggles against him and pushes him away . )', ' ( End of flashback . )', ' ( Resume to present . )', ' [[Det._Vartann]] and what happened next ?', ' [[Adam_Novak]] her taxi finally showed up', ' [[Lawyer]] i spoke to both the bartender at the highball and the cab company , and a cab was ordered and drove the victim home', "" [[Det._Vartann]] mr novak , have you ever been to holly pearson 's house ?"", ' [[Adam_Novak]] no', ' [[Adam_Novak]] i have no idea where she lived', ' [[Det._Vartann]] then how do you explain your courthouse keycard which we found near her body ?', ' [[Det._Vartann]] csi matched the prints on the card', ' [[Det._Vartann]] only yours', "" [[Adam_Novak]] every attorney in the public defender 's office is issued one card"", ' [[Adam_Novak]] mine has never left my car', ' [[Adam_Novak]] i keep it in the center console', "" [[Adam_Novak]] you do n't need a warrant"", ' [[Adam_Novak]] you have my permission to check', ' [[Adam_Novak]] it should be there', "" [[Det._Vartann]] well , that wo n't be hard to verify , because your car 's already at csi""]",0,None
27,"[' ( Catherine walks down the hallway toward the garage . )', ' ( Nick is standing with the car . )', ' [[Catherine]] nick', ' [[Nick]] hey', ' [[Catherine]] the center console', ' [[Catherine]] was there a parking lot car key inside ?', ' [[Nick]] no', ' [[Nick]] two sticks of gum and a pack of condoms why ?', "" [[Catherine]] suspect claims some incriminating evidence found at the second crime scene was n't his"", ' [[Catherine]] it looks like he was lying', ' [[Catherine]] we got him', "" [[Nick]] i do n't know how you 're going to take this , but i think this car was recently broken into"", ' [[Nick]] these scratches ... they look fresh', ' [[Nick]] b and e 101', "" ( Nick points to the scratches in the driver 's side window . )"", ' [[Catherine]] the slim jim', ' ( Quick flash of : A Slim Jim is pushed into the car door through the window slot . )', ' ( Camera zooms into the door showing the slim Jim pushing down onto the door lock mechanism . )', ' ( End of flash . )', ' ( Resume to present . )', "" [[Nick]] somebody could 've swiped his keycard"", ' [[Catherine]] and then locked the car back up', "" [[Catherine]] novak would n't be the wiser until he drove into the courthouse again did you find any prints ?"", ' [[Nick]] smudges and partials , inside and out', "" [[Catherine]] run 'em""]",1,Evidence
28,"[' ( Nick scans the prints into the database and runs the search . )', ' ( Det Vartann and Catherine question Jeff Simon . )', "" [[Det._Vartann]] let 's run through the night alice died again"", "" [[Jeff_Simon]] we 've been through this"", ' [[Jeff_Simon]] i have an alibi', ' [[Det._Vartann]] your alibi only proves you lost track of her', ' [[Det._Vartann]] you knew where alice lived', "" [[Catherine]] have you been in adam novak 's car recently ?"", ' [[Jeff_Simon]] no', "" [[Jeff_Simon]] i do n't even know an adam novak"", ' [[Det._Vartann]] but you identified his vehicle as the car that alice left the bar in', "" [[Jeff_Simon]] i did n't know whose car it was"", ' [[Catherine]] then why did we find your prints in it ?', "" [[Jeff_Simon]] maybe somebody 's trying to frame me"", "" [[Catherine]] no , but i think that you 're familiar with the concept"", ' [[Catherine]] you were obsessed with alice , and when you saw adam having at her , you flipped out', ' ( Quick flashback to : [_NIGHT_] Jeff Simon sits in his car and watches Adam Novak and Alice Granger kissing . )', ' ( End of flashback . )', ' ( Resume to present . )', "" [[Catherine]] i mean , here 's a woman that you ca n't get any traction with , yet she 's willing to do a stranger she picked up in a bar"", ' ( Quick flashback to : [_NIGHT_] Alice Granger gets out of the car and giggles . )', ' ( Jeff Simon sits in his car , hands gripping the steering wheel as he watches her . )', ' ( He turns his lights on . )', ' ( Alice turns around . )', ' ( Jeff gets out of the car . )', ' [[Alice_Granger]] jeff ?', ' ( She sees him and starts running . )', ' ( He runs after her . )']",1,Motive
29,"["" ( Jeff cover 's Alice 's face with her jacket . )"", ' ( End of flashback . )', ' ( Resume to present . )', "" [[Catherine]] i mean , lucky for you , the highball was adam 's second home"", "" ( Quick flashback to : [_HIGHBALL_-_PARKING_LOT_-_NIGHT_] Jeff Simon breaks into Adam Novak 's car and steals Adam 's card key . )"", ' [[Catherine]] the next night , you came back and saw his car in the parking lot', ' [[Catherine]] creative justice', ' [[Catherine]] you could get them both', ' ( Cut to : Adam is hitting on Holly outside the Highball . )', ' [[Catherine]] it was just bad luck that holly pearson met adam that night', ' ( Cut to : Adam follows Holly home . )', ' [[Catherine]] you had no reason to kill her , but you followed her home and worked up the nerve', ' ( Adam turns and sees Holly on the sidewalk looking for her key . )', ' ( He gets out of the car . )', ' ( Holly looks up and sees him . )', ' ( She turns and starts running . )', ' ( Jeff takes out the gun and follows her . )']",1,Motive
30,"["" ( Jeff cover 's Holly 's face with her jacket . )"", ' ( He turns and leaves . )', "" ( He takes Adam 's card key out of his pocket and drops it on the ground . )"", ' ( End of flashback . )', ' ( Resume to present . )', ' [[Catherine]] you made one mistake , though', ' [[Catherine]] the evidence that you used to frame him brought us back to you', ' ( Jeff turns and looks away . )']",0,None
31,"[' ( Mia is tossing all the kits away . )', ' ( Grissom appears in the doorway . )', ' [[Grissom]] you figured out the source of the contamination ?', ' [[Mia_Dickerson]] i got a positive result off my negative control', ' [[Mia_Dickerson]] matched the contamination', ' [[Mia_Dickerson]] turns out somebody at the manufacturer forgot to put on their mask and then sneezed or coughed on what was supposed to be a sterile product', "" [[Grissom]] you have to collect everyone 's swabs"", ' [[Mia_Dickerson]] kits', ' [[Mia_Dickerson]] trucks', ' [[Mia_Dickerson]] vests', ' [[Mia_Dickerson]] work stations', ' [[Grissom]] how long till the new shipment gets here ?', "" [[Mia_Dickerson]] it 's on its way"", ' [[Mia_Dickerson]] until then , do it old school', ' ( Grissom turns and leaves . )', ' ( Grissom writes in a file as he walks down the hallway . )', ' [[Catherine]] gil', ' ( He looks up ; Catherine steps out into the hallway and joins him . )', "" [[Catherine]] i 'd ask you out for a drink , but under the circumstances , it 's , uh"", ' ( He looks at her , then goes back to his file . )', "" ( He does n't say anything . )"", ' [[Catherine]] okay , how long is this going to go on ?', "" [[Grissom]] i do n't know , catherine"", ' [[Catherine]] gil , it was an act of omission', ' [[Grissom]] how many times have we heard a public defender say that ?', ' [[Catherine]] i went out after work', ' [[Catherine]] is it a crime to want a little human contact ?', "" [[Grissom]] i guess that 's why i do n't go out"", ' ( Grissom walks away . )', ' ( Camera holds on Catherine . )']",0,None
